id,city_id,name,campus_name,f1_certified,m1_certified,campus_id,created_at,updated_at,url
7947c356-9c62-4436-8c3c-8da9a23c81ed,e4a22259-3006-4f04-bf55-264c5ea09821,Mount Mercy University Mount Mercy University,Mount Mercy University Mount Mercy University,true,false,306,2025-05-18 20:44:31.938568+00,2025-05-18 20:44:31.938568+00,
79c25e04-da35-4310-84b8-4ca409b12398,4a5814c1-1805-479c-adaa-1a043badde70,Williams College Williams College,Williams College Williams College,true,false,6371,2025-05-18 22:09:27.59829+00,2025-05-18 22:09:27.59829+00,
79c7aac8-3792-4a46-b65e-32d85d91d136,404b6182-a299-4ba3-878f-aec26a5f71cf,Texas Bible College Texas Bible College,Texas Bible College Texas Bible College,true,false,5427,2025-05-18 20:55:14.501827+00,2025-05-18 20:55:14.501827+00,
79cd3f12-da03-4f38-a7a0-6cb2dac13989,a4c19c95-fc0f-49a7-a815-4ca80bbd7615,Harrisburg Area Community College Gettysburg Campus,Harrisburg Area Community College Gettysburg Campus,true,false,132703,2025-05-18 22:55:12.126624+00,2025-05-18 22:55:12.126624+00,
79ceef8b-068e-4e1d-9de2-3e3d78989025,5e472295-db51-4792-ab28-a07bd506daa6,Bates Technical College - Open Doors,Bates Technical College - Open Doors,false,false,,2025-05-19 00:31:04.743797+00,2025-05-19 00:31:04.743797+00,
79e4a35b-2e56-4992-a0ee-da5bd2845dc8,4c800340-e37f-4cbc-8516-52d951d5f644,LUISA PINEIRO FUENTES SCHOOL OF SCIENCE AND DISCOVERY,LUISA PINEIRO FUENTES SCHOOL OF SCIENCE AND DISCOVERY,false,false,,2025-05-19 00:40:08.890923+00,2025-05-19 00:40:08.890923+00,
79e62e1d-d74d-4bcd-abc1-2da8121eab6c,11dc9bc6-e45c-4483-b5e5-7c0e70cc077b,College Heights Christian School College Heights Christian School,College Heights Christian School College Heights Christian School,true,false,74548,2025-05-18 20:58:20.185092+00,2025-05-18 20:58:20.185092+00,
7a26b5d5-9ff4-47e2-941b-92872ecb0221,bd58c687-9720-4cca-b182-7afad45685b6,Worsham College of Mortuary Science Worsham College of Mortuary Science,Worsham College of Mortuary Science Worsham College of Mortuary Science,false,true,38297,2025-05-18 21:51:03.690052+00,2025-05-18 21:51:03.690052+00,
7a29cc0f-5e30-43d6-ae72-8a84a6e36401,721e4a2c-33cc-42e4-b3cc-4f370796ef90,Savannah Technical College Savannah Technical College - Liberty,Savannah Technical College Savannah Technical College - Liberty,true,true,166459,2025-05-18 21:32:08.750816+00,2025-05-18 21:32:08.750816+00,
7a2e9854-f2d8-4b72-9667-203f2957fa92,238ecc10-c546-4349-bda3-bc8516f4ebc3,Online School of Arizona,Online School of Arizona,false,false,,2025-05-19 00:23:37.15531+00,2025-05-19 00:23:37.15531+00,
7a4f4549-b495-4d1f-8d89-2c687752a4d2,2586777e-af3f-406b-9b63-e8c46499bfef,KATHERINE JOHNSON TECHNOLOGY MAGNET ACADEMY,KATHERINE JOHNSON TECHNOLOGY MAGNET ACADEMY,false,false,,2025-05-19 00:41:49.190619+00,2025-05-19 00:41:49.190619+00,
7a7ff27a-4b40-4a28-bfed-234b2aad6b33,c0bab266-68c5-4c65-813c-9567dd110387,Trident Technical College Trident Technical College,Trident Technical College Trident Technical College,true,true,8610,2025-05-18 20:49:59.957075+00,2025-05-18 20:49:59.957075+00,
7a89d8ff-7f7b-4c0a-aa51-f9c2ecf2bf69,6e93f7af-d56d-456a-a888-a7eb9dc58ef1,Northwestern University Kellogg School of Management,Northwestern University Kellogg School of Management,true,false,118288,2025-05-18 21:32:32.531128+00,2025-05-18 21:32:32.531128+00,
7a9668b6-5015-4008-94e0-d1d59cd7c68e,f9554892-1494-44e3-a395-ec7c53c05ead,Montana State University - Bozeman Montana State University - Bozeman,Montana State University - Bozeman Montana State University - Bozeman,true,true,4029,2025-05-18 20:51:11.081055+00,2025-05-18 20:51:11.081055+00,
7a9f4a8f-6165-49e7-b085-04a2d3188afb,193b088d-6d99-4543-81a6-892aa97767de,La Crosse Polytechnic School,La Crosse Polytechnic School,false,false,,2025-05-19 00:38:21.27031+00,2025-05-19 00:38:21.27031+00,
7a9f967f-2430-4762-9e4f-e914f6ad5ea6,7c270df7-0996-4131-b868-d5c7061302a4,Peralta Community College District College of Alameda,Peralta Community College District College of Alameda,true,true,4525,2025-05-18 19:56:38.257662+00,2025-05-18 19:56:38.257662+00,
7aadae8d-b805-4958-9a94-0094faa61c0f,0bd60fbb-9726-4a64-819d-448bc46671e2,Florida Memorial University Florida Memorial University,Florida Memorial University Florida Memorial University,true,false,6639,2025-05-18 21:12:19.709464+00,2025-05-18 21:12:19.709464+00,
7aba9db3-5884-4975-ad49-8a4fcd8796ff,e6561bdd-b993-4557-9d25-e4ef5548fcf8,Pennsylvania College of Technology Pennsylvania College of Technology,Pennsylvania College of Technology Pennsylvania College of Technology,true,true,4453,2025-05-18 21:25:34.050939+00,2025-05-18 21:25:34.050939+00,
7ac19153-2c40-466e-b885-77c630b93cdc,aeb01461-4967-4253-8a19-294eec168c9b,College Park High,College Park High,false,false,,2025-05-19 00:51:20.591916+00,2025-05-19 00:51:20.591916+00,
7ac9f749-da3c-47cf-a930-63eb0bb68a58,0bb91101-1ff4-4b9f-a28e-715b1852d7c5,Faulkner University Faulkner University at Mobile,Faulkner University Faulkner University at Mobile,true,false,28938,2025-05-18 19:53:09.665241+00,2025-05-18 19:53:09.665241+00,
7aca4127-8a12-4ccf-93cd-e83018ccbb05,66651337-c5ea-4368-9c89-4f034da1224d,"California State University California State University, Bakersfield","California State University California State University, Bakersfield",true,false,187,2025-05-18 19:55:23.982861+00,2025-05-18 19:55:23.982861+00,
7ad8a663-1f6c-46ca-9630-5ca2a6b4c76d,a3119f2d-1bdd-4bbf-8f8a-adc887ff9e23,Catawba Valley Community College Catawba Valley Community College,Catawba Valley Community College Catawba Valley Community College,true,false,2562,2025-05-18 21:16:35.896729+00,2025-05-18 21:16:35.896729+00,
7ada7f6b-6822-4825-98e9-2c972250d74c,7887f177-b0a3-4e5c-b018-1e7fdec49b86,Overland Christian Schools Kansas City College and Bible School,Overland Christian Schools Kansas City College and Bible School,true,false,186586,2025-05-18 21:18:58.288128+00,2025-05-18 21:18:58.288128+00,
7b043336-e0f9-43a9-98e0-b813c6dd83d8,9db4ec53-6ae6-4c1f-973d-9afe66231ebc,PSJA COLLEGIATE SCHOOL OF HEALTH PROFESSIONS,PSJA COLLEGIATE SCHOOL OF HEALTH PROFESSIONS,false,false,,2025-05-19 00:50:02.262619+00,2025-05-19 00:50:02.262619+00,
7b14a568-d3b1-43fd-8ea8-b4b0bf93d199,5eacb141-74aa-4bfd-aa15-424bf41c8a59,Everglades University Everglades University,Everglades University Everglades University,true,false,11050,2025-05-18 20:21:24.888536+00,2025-05-18 20:21:24.888536+00,
7b14f200-d1a1-43c0-944a-9167add1b477,5c0d2e4b-ea0e-41bb-b384-0ae8f3b58ef8,University of Mary University of Mary- Fargo Campus,University of Mary University of Mary- Fargo Campus,true,false,3824956,2025-05-18 20:45:42.275267+00,2025-05-18 20:45:42.275267+00,
7b19d44e-84b4-445c-904e-2be7c9bb82ff,52ab4360-0aff-42d3-a3cf-059818ebceff,GEORGE STONE TECHNICAL COLLEGE,GEORGE STONE TECHNICAL COLLEGE,false,false,,2025-05-19 00:30:15.975085+00,2025-05-19 00:30:15.975085+00,
7b388464-29b6-4e12-84e0-85b6e69aa3b0,5e472295-db51-4792-ab28-a07bd506daa6,University of Puget Sound University of Puget Sound,University of Puget Sound University of Puget Sound,true,false,1553,2025-05-18 20:24:15.120788+00,2025-05-18 20:24:15.120788+00,
7b4955b4-908a-467b-a0e4-c479955bbf18,5bfb3e1a-58d6-4a75-9da9-a482cbdcab6d,Siebel Institute of Technology Siebel Institute of Technology,Siebel Institute of Technology Siebel Institute of Technology,false,true,11320,2025-05-18 20:00:23.6629+00,2025-05-18 20:00:23.6629+00,
7b6aec11-f233-4307-8af9-669fed880930,5bfb3e1a-58d6-4a75-9da9-a482cbdcab6d,City Colleges of Chicago Kennedy-King College,City Colleges of Chicago Kennedy-King College,true,false,7299,2025-05-18 20:00:08.658577+00,2025-05-18 20:00:08.658577+00,
7ba79af2-ad51-45a4-a8d1-de8c696d4030,a66b112c-c9cf-4c06-9bd2-dfd574920b73,Langston University Langston University-OKC Campus,Langston University Langston University-OKC Campus,true,false,129289,2025-05-18 20:05:42.487386+00,2025-05-18 20:05:42.487386+00,
7bba2a27-69f3-481f-ab1a-d40b552da5ff,0ecbd347-f9d6-4ca5-8064-b8d6f0e7d5d3,Occidental College Occidental College,Occidental College Occidental College,true,false,915,2025-05-18 18:43:14.300727+00,2025-05-18 18:43:14.300727+00,
7bd68dc9-3ab6-4dd8-a3be-63ff28bd0a51,ba8bf64f-45a9-4153-bd6b-ed82bb60edf9,Southern Union State Community College Opelika Campus,Southern Union State Community College Opelika Campus,true,true,2337244,2025-05-18 20:46:24.357596+00,2025-05-18 20:46:24.357596+00,
7be7b1e6-67b3-4aae-a290-a0eeb42cb525,5bfb3e1a-58d6-4a75-9da9-a482cbdcab6d,City Colleges of Chicago Harold Washington College,City Colleges of Chicago Harold Washington College,true,false,7304,2025-05-18 20:00:07.109791+00,2025-05-18 20:00:07.109791+00,
7bf1de13-3fbc-41cf-8aa3-882e30f6f8ee,234d4801-9408-4799-85a4-a665542bc15e,Renton Technical College,Renton Technical College,false,false,,2025-05-19 00:31:03.903248+00,2025-05-19 00:31:03.903248+00,
7bf4792e-ea63-41a8-a08c-af9fd73d6c1d,b4f539b0-2bea-4bac-b62d-7d6495ed1295,MLK JR HIGH TECH & COMPUTER MAGNET SCHOOL,MLK JR HIGH TECH & COMPUTER MAGNET SCHOOL,false,false,,2025-05-19 00:33:41.799838+00,2025-05-19 00:33:41.799838+00,
7c066be4-c00b-41b8-96e7-e876c6b55396,877c3132-d65e-477f-b782-6e2c0a0f5bbb,Georgia Institute of Technology Georgia Institute of Technology,Georgia Institute of Technology Georgia Institute of Technology,true,false,6357,2025-05-18 20:05:10.242956+00,2025-05-18 20:05:10.242956+00,
7c2c5a76-c5ed-4078-ac5d-574509b3e933,edfd8854-a070-4ac3-9d18-c9dcb1f9ce23,Bethesda University Bethesda University,Bethesda University Bethesda University,true,false,289,2025-05-18 19:55:08.565851+00,2025-05-18 19:55:08.565851+00,
7c3dba86-2ade-4aef-9254-bcefdaf1c9cf,3dd6f75e-e30a-4fe8-bb1f-8448abbbdf82,Herzing University Herzing University Kenosha,Herzing University Herzing University Kenosha,true,false,118119,2025-05-18 21:00:19.259708+00,2025-05-18 21:00:19.259708+00,
7c47bfea-1a95-4117-87e7-5103c85ebc81,4c800340-e37f-4cbc-8516-52d951d5f644,The City University of New,The City University of New,true,false,5368,2025-05-18 21:08:52.945646+00,2025-05-18 21:08:52.945646+00,
7c729278-1b50-4e99-a99f-793de3800350,e49af941-b1e3-4b04-b3c0-64eb6fd24300,Wild Rose School of Creative,Wild Rose School of Creative,false,false,,2025-05-19 00:42:39.830787+00,2025-05-19 00:42:39.830787+00,
7c8c2ec5-0e21-41eb-87a6-1bc2a003d1e8,181016f5-d366-452c-a417-3214a47c87a7,WAKULLA INSTITUTE,WAKULLA INSTITUTE,false,false,,2025-05-19 00:53:33.27922+00,2025-05-19 00:53:33.27922+00,
7c8e0a03-5fa7-4ba7-99ef-5bf571d952b5,e301e64f-11b4-4820-9961-44c5a4cbdeb5,University of Pittsburgh University of Pittsburgh at Greensburg,University of Pittsburgh University of Pittsburgh at Greensburg,true,false,4559,2025-05-18 21:50:07.104673+00,2025-05-18 21:50:07.104673+00,
7ca43cfa-1753-4b70-aaf3-2bd5bcace3c4,9373e5e3-b0a1-4f0d-9712-839e5c6ba71d,Corbin School of Innovation,Corbin School of Innovation,false,false,,2025-05-19 00:50:42.25428+00,2025-05-19 00:50:42.25428+00,
7ca5b6af-2d0a-495f-a8fc-2d01179a0376,6b67e1cb-2b65-460c-b200-4919ca0cf52b,MOBERLY AREA TECHNICAL CTR.,MOBERLY AREA TECHNICAL CTR.,false,false,,2025-05-19 00:50:50.843296+00,2025-05-19 00:50:50.843296+00,
7cb02e2f-e712-438c-9964-8451df7a9e90,76db80c9-8646-4a6c-8fe9-300c45e1c273,Austin Community College Round Rock Campus,Austin Community College Round Rock Campus,true,true,126800,2025-05-18 20:27:14.627162+00,2025-05-18 20:27:14.627162+00,
7cbceef7-0501-462a-aaac-a132476dbb44,7869d78e-3e56-49f0-bdca-5960e9143419,Trine University Trine University-Ft. Wayne Regional Ctr,Trine University Trine University-Ft. Wayne Regional Ctr,true,false,863644,2025-05-18 20:43:31.650728+00,2025-05-18 20:43:31.650728+00,
7cc7573a-69d9-4990-ab71-896b191ead83,97158c44-a055-4897-9d55-8ca3cfaeb976,Northwest Florida State College South Walton Campus,Northwest Florida State College South Walton Campus,true,true,182475,2025-05-18 22:00:22.797059+00,2025-05-18 22:00:22.797059+00,
7cdc737b-b052-49b6-b594-70d40fee9a08,b0fb4cdb-8e1d-445c-b20f-44f8e3fdf39a,University of Arkansas - Fort Smith University of Arkansas - Fort Smith,University of Arkansas - Fort Smith University of Arkansas - Fort Smith,true,false,2943,2025-05-18 19:53:02.768289+00,2025-05-18 19:53:02.768289+00,
7ce30902-6209-42c9-a959-0354c0cbad12,5bd614d0-e4df-4dbc-aa2c-5016056e7db9,COLLEGE PARK H S,COLLEGE PARK H S,false,false,,2025-05-19 00:41:44.438391+00,2025-05-19 00:41:44.438391+00,
7ce4f8e5-c556-4bf2-b20f-1eff7428e9e6,f4b7f350-5b92-4a94-9176-2af6aa1b88e7,Miami Dade College West Campus,Miami Dade College West Campus,true,true,5150373,2025-05-18 21:32:35.823155+00,2025-05-18 21:32:35.823155+00,
7cec43dc-e994-4f15-8dea-2bf9873ae41c,c4c70197-a016-49bc-814d-09f1327737c9,South Verde Technology Magnet,South Verde Technology Magnet,false,false,,2025-05-19 00:46:13.458988+00,2025-05-19 00:46:13.458988+00,
7d70ac18-a1ec-4f3c-bbe6-fc1d9c440006,64fdb8ba-9ef2-410a-ad2b-6246d4bebb43,Asheville-Buncombe Technical Community College Asheville Campus,Asheville-Buncombe Technical Community College Asheville Campus,true,true,2333,2025-05-18 20:21:55.497931+00,2025-05-18 20:21:55.497931+00,
7da5de41-3416-4242-8215-d996cdc02d38,0ecbd347-f9d6-4ca5-8064-b8d6f0e7d5d3,Caroline University Caroline University,Caroline University Caroline University,true,false,5226420,2025-05-18 18:43:10.814746+00,2025-05-18 18:43:10.814746+00,
7db98e46-2a65-44f0-a6e4-f900c58b8c60,7cd2eed9-ec17-418e-83fc-4174e1e78474,Coconino Community College Lone Tree Campus,Coconino Community College Lone Tree Campus,true,false,5081194,2025-05-18 19:56:42.821108+00,2025-05-18 19:56:42.821108+00,
7dc2b35b-10fb-4501-ba35-bdd43ab71549,f7b3fc34-0d53-4d7d-9494-ff58e76212a7,Stanford University Stanford Hopkins Marine Station,Stanford University Stanford Hopkins Marine Station,true,false,139061,2025-05-18 22:15:30.136228+00,2025-05-18 22:15:30.136228+00,
7dc5bdcc-1952-4eab-b243-e099e1fe724b,3709f91e-d028-477b-9bc8-dc39b7bf4331,Minnesota North College Minnesota North College-Mesabi Virginia,Minnesota North College Minnesota North College-Mesabi Virginia,true,true,5170056,2025-05-18 21:57:41.927683+00,2025-05-18 21:57:41.927683+00,
7dd62165-b54f-4271-9379-515c4caa47e7,8ed0ff57-3f83-4ecf-b9bd-41ef4bb5e9c7,Fresno Pacific University North Fresno Regional Center,Fresno Pacific University North Fresno Regional Center,true,false,176581,2025-05-18 18:47:29.597171+00,2025-05-18 18:47:29.597171+00,
7de69bbe-d469-4d4e-8d5d-7059ec0c3d69,0ecbd347-f9d6-4ca5-8064-b8d6f0e7d5d3,Crenshaw Sci Tech Engr Math and Med Magnet,Crenshaw Sci Tech Engr Math and Med Magnet,false,false,,2025-05-19 00:17:50.961988+00,2025-05-19 00:17:50.961988+00,
7dfbdf5e-7baf-4d3b-ad52-94e123aac561,4b990476-fafd-4c97-ad0e-09346944fa9a,West Chester University West Chester,West Chester University West Chester,true,false,1292,2025-05-18 21:42:23.741041+00,2025-05-18 21:42:23.741041+00,
7e120ba4-70ad-4c7a-b8f3-90e6639c1edb,b404ed98-6d74-4fdf-bd45-21f266ef9750,Rowan University Rowan University,Rowan University Rowan University,true,false,81,2025-05-18 22:09:39.570751+00,2025-05-18 22:09:39.570751+00,
7e4616bd-02af-4216-8f46-a73c6340825f,bf776d82-40ac-47f1-967a-0e67d77fc852,Campbell University Campbell University -School of Law,Campbell University Campbell University -School of Law,true,false,806246,2025-05-18 20:10:30.681158+00,2025-05-18 20:10:30.681158+00,
7e48a9f7-a23d-494b-8f30-5b0bd1f17c76,1eb0c736-930a-413c-a450-c9c37875faf0,University of Texas Health Science Center at San Antonio UT Education and Research Cntr at Laredo,University of Texas Health Science Center at San Antonio UT Education and Research Cntr at Laredo,true,false,2250044,2025-05-18 20:28:52.893233+00,2025-05-18 20:28:52.893233+00,
7ecbb0d4-366f-426c-8288-c251422ab130,e391db4a-ea11-4eb2-b15f-630edc403d1c,Henry Ford College Henry Ford College,Henry Ford College Henry Ford College,true,false,8747,2025-05-18 20:42:39.112388+00,2025-05-18 20:42:39.112388+00,
7ecc1e7c-9855-49bf-8361-936fa973d456,238ecc10-c546-4349-bda3-bc8516f4ebc3,PCJTED - Aztec Middle College North West,PCJTED - Aztec Middle College North West,false,false,,2025-05-19 00:23:30.033082+00,2025-05-19 00:23:30.033082+00,
7ee8fdd0-9c36-4b6f-ac39-c52b1db49128,0ecbd347-f9d6-4ca5-8064-b8d6f0e7d5d3,California College of ASU California College of ASU,California College of ASU California College of ASU,true,false,10287,2025-05-18 18:43:10.654524+00,2025-05-18 18:43:10.654524+00,
7ef87ab9-f9fc-4dc0-9201-2805b463beb9,a8aa9d4d-9265-468c-969e-68f557b1ea27,Pacific College Pacific College,Pacific College Pacific College,true,false,3396347,2025-05-18 21:04:27.288742+00,2025-05-18 21:04:27.288742+00,
7f1772bd-5192-4194-9370-0d0c3de85745,17047176-fc9a-4a80-aa2f-b1776b05d71a,Brenau University Brenau Univ./North Atlanta,Brenau University Brenau Univ./North Atlanta,true,false,112409,2025-05-18 20:48:06.718904+00,2025-05-18 20:48:06.718904+00,
7f3141e6-8712-4377-831f-e121a0b1b927,ba35700c-7884-4278-8b3a-5d59d31e4767,Academy of Technology & Leadership at Saticoy,Academy of Technology & Leadership at Saticoy,false,false,,2025-05-19 00:38:44.123328+00,2025-05-19 00:38:44.123328+00,
7f3fbf09-4ef6-4478-b18d-74f21397b7fd,662b3bdd-60af-4bf9-a829-d0cf0eef0492,Lumen Scholar Institute,Lumen Scholar Institute,false,false,,2025-05-19 00:36:45.398027+00,2025-05-19 00:36:45.398027+00,
7f57e23a-cc5a-461d-b22e-bb9ef63ab720,bf650a6c-cc0a-41ec-a4e5-e3619b8a0f6d,University of North Texas Collin Higher Education Center (CHEC),University of North Texas Collin Higher Education Center (CHEC),true,false,137873,2025-05-18 21:17:18.005532+00,2025-05-18 21:17:18.005532+00,
7f59a79f-544e-4df1-863f-ed817f085653,e391db4a-ea11-4eb2-b15f-630edc403d1c,University of Michigan - Dearborn University of Michigan,University of Michigan - Dearborn University of Michigan,true,false,4946,2025-05-18 20:42:39.418362+00,2025-05-18 20:42:39.418362+00,
7f5a1ca3-2596-4641-ab2e-7c491fe59b48,5cc26d36-39b4-4c9f-8173-1da44bc41afe,The University of Findlay The University of Findlay,The University of Findlay The University of Findlay,true,false,2419,2025-05-18 21:45:24.132253+00,2025-05-18 21:45:24.132253+00,
7f66e105-0839-47f5-a150-6717cec42250,01f472cf-0f8c-4255-977a-c60a99bd580e,URBAN ASSEMBLY SCHOOL OF DESIGN AND CONSTRUCTION,URBAN ASSEMBLY SCHOOL OF DESIGN AND CONSTRUCTION,false,false,,2025-05-19 00:25:17.000689+00,2025-05-19 00:25:17.000689+00,
7f6961e0-aeee-4674-a1cb-82bff26ce9ce,f2515870-5b1b-413d-9a84-6046aca4a4a0,Stockton University Stockton University - Atlantic City,Stockton University Stockton University - Atlantic City,true,false,5061165,2025-05-18 20:56:58.621765+00,2025-05-18 20:56:58.621765+00,
7f6d8b8c-b5be-4496-b36e-22761bca1a8a,15b4408d-22b8-4eb9-864e-fe443359296a,CHRISTINE DONNELL SCHOOL OF THE ARTS,CHRISTINE DONNELL SCHOOL OF THE ARTS,false,false,,2025-05-19 00:27:46.196008+00,2025-05-19 00:27:46.196008+00,
7f73b277-f467-4f6f-a681-4215783e9b7a,13a39a3d-e296-4fb5-a55a-fc74a3747cd0,University of Connecticut Stamford Campus,University of Connecticut Stamford Campus,true,false,8993,2025-05-18 20:44:40.389847+00,2025-05-18 20:44:40.389847+00,
7f8c8690-d6b2-4eca-91f2-fbafc1b66c38,a17a6b92-cd23-4671-8e22-4a0f9f6a27a0,Oral Roberts University Oral Roberts University,Oral Roberts University Oral Roberts University,true,false,3915,2025-05-18 20:26:04.158513+00,2025-05-18 20:26:04.158513+00,
7f945f53-cffe-44df-b6e7-f8ee6ff32715,ce2a86db-089e-408a-b32f-a76fc86b8c01,HARMONY SCHOOL OF INNOVATION - EL PASO,HARMONY SCHOOL OF INNOVATION - EL PASO,false,false,,2025-05-19 00:27:50.389875+00,2025-05-19 00:27:50.389875+00,
7fa245e6-315b-4366-ac1d-388b246d720b,23bfb26f-e010-4c3a-9861-5e4b781c8d8e,Valencia College Poinciana Campus,Valencia College Poinciana Campus,true,false,5083436,2025-05-18 20:48:43.110066+00,2025-05-18 20:48:43.110066+00,
7fb0f32d-fd93-4378-a613-89f54b706c0d,3ebf1b9a-e866-465f-a720-48fa208a4e5c,The City University of New,The City University of New,true,false,5393,2025-05-18 21:05:30.109524+00,2025-05-18 21:05:30.109524+00,
7fb2fde0-7308-4da4-991c-3319604ef0eb,c2fbce05-dd72-4764-969c-43c72fa36744,UCASUniversity of Cosmetology Arts & Sciences University of Cosmetology Arts & Scienc1,UCASUniversity of Cosmetology Arts & Sciences University of Cosmetology Arts & Scienc1,false,true,7600,2025-05-18 20:28:12.96799+00,2025-05-18 20:28:12.96799+00,
7fe2aeac-ff92-4b02-b7ce-8340d802de24,73674253-a9c0-4721-ab9b-d246a17a6582,Johnson C Smith University Johnson C Smith University,Johnson C Smith University Johnson C Smith University,true,false,14409,2025-05-18 20:10:52.475894+00,2025-05-18 20:10:52.475894+00,
800e480b-8d83-4c27-9087-05e748387877,096a50a7-1bc8-4bc1-9d71-00523d5ac86c,Southwest Texas Junior College Eagle Pass,Southwest Texas Junior College Eagle Pass,true,true,5155,2025-05-18 21:34:28.684573+00,2025-05-18 21:34:28.684573+00,
8012c69c-c839-4bee-9836-43fd754a4dfc,124404f4-8dec-4a26-a67e-04a6f42397a7,University of Arizona UA South Sierra Vista,University of Arizona UA South Sierra Vista,true,false,139755,2025-05-18 19:56:28.621815+00,2025-05-18 19:56:28.621815+00,
80291caf-b1de-4e49-97eb-eef7e8e6ed25,1eb0c736-930a-413c-a450-c9c37875faf0,HARMONY SCHOOL OF INNOVATION - LAREDO,HARMONY SCHOOL OF INNOVATION - LAREDO,false,false,,2025-05-19 00:31:38.169835+00,2025-05-19 00:31:38.169835+00,
802ffb61-cb10-4d0a-aad8-4c23eb9fae59,d52ae451-6f08-4258-8735-e0d330cc9d26,"Baton Rouge Community College Baton Rouge Com. Col., Frazier Building","Baton Rouge Community College Baton Rouge Com. Col., Frazier Building",true,false,142144,2025-05-18 20:11:43.566671+00,2025-05-18 20:11:43.566671+00,
803111ba-ae65-45c6-935e-c4bf80e4ec90,124404f4-8dec-4a26-a67e-04a6f42397a7,Cochise College Cochise College Sierra Vista,Cochise College Cochise College Sierra Vista,true,true,4045,2025-05-18 19:56:28.307918+00,2025-05-18 19:56:28.307918+00,
808bc3f0-5815-4550-bb15-29c83e692cde,868042c9-fd87-430a-ae87-e92f5f3fb041,Texas Woman's University Texas Woman's University,Texas Woman's University Texas Woman's University,true,false,547,2025-05-18 20:29:44.419763+00,2025-05-18 20:29:44.419763+00,
8097e923-80a0-48ac-8fab-365a4d1607c5,ae333adb-62aa-4f27-9ad2-0b8232db2868,Bunker Hill Community College Malden Satellite,Bunker Hill Community College Malden Satellite,true,false,169629,2025-05-18 21:55:18.636618+00,2025-05-18 21:55:18.636618+00,
809c3b35-2db5-4949-a112-b2b57c78fb25,d9fcef4a-e55d-4969-8972-b72fda46383a,Grossmont Middle College High,Grossmont Middle College High,false,false,,2025-05-19 00:33:50.409615+00,2025-05-19 00:33:50.409615+00,
80f1681d-26ce-4576-bb9c-3774441e1dac,6b972869-3616-4193-9d9a-594fd4db95e0,Hannibal LaGrange University Hannibal LaGrange University,Hannibal LaGrange University Hannibal LaGrange University,true,false,11599,2025-05-18 21:43:55.961862+00,2025-05-18 21:43:55.961862+00,
80f3f15b-b9f7-4b5e-b055-d31d0fb9d686,62fd6028-737b-4cc2-b65a-3a627afd0c3a,University of La Verne University of La Verne,University of La Verne University of La Verne,true,false,7955,2025-05-18 21:51:24.216425+00,2025-05-18 21:51:24.216425+00,
810923a9-1940-427e-b783-d3d57b2c7c8b,ed8b079a-8069-4f99-9fe7-2f3f5ec20f51,University of the Ozarks University of the Ozarks,University of the Ozarks University of the Ozarks,true,false,2625,2025-05-18 19:58:16.238916+00,2025-05-18 19:58:16.238916+00,
811a35fe-85ef-448e-8237-81f549674602,1eb0c736-930a-413c-a450-c9c37875faf0,Laredo College Laredo College South,Laredo College Laredo College South,true,true,5163932,2025-05-18 20:28:52.255474+00,2025-05-18 20:28:52.255474+00,
81202509-456b-4b02-baf3-c8b83d6ec8a0,f9d37f61-4b65-450d-9430-f63dc25dbdca,MIJTED - Yavapai College Agribusiness & Technology Center,MIJTED - Yavapai College Agribusiness & Technology Center,false,false,,2025-05-19 00:51:09.270751+00,2025-05-19 00:51:09.270751+00,
81206367-9513-4740-9b82-e17998e3e9e8,ab4ca202-3ce0-4287-8765-a99d7371aa2f,John Paul the Great Catholic University Escondido,John Paul the Great Catholic University Escondido,true,false,1060043,2025-05-18 20:39:37.990018+00,2025-05-18 20:39:37.990018+00,
81310264-f3c7-4c62-b288-c8f99f4b536d,7cbf1311-708c-45f2-8837-0f00d65513f6,Jardine Technology Middle Magnet,Jardine Technology Middle Magnet,false,false,,2025-05-19 00:32:08.951398+00,2025-05-19 00:32:08.951398+00,
814c224e-aed1-48cb-b237-90bb1360f703,8ed0ff57-3f83-4ecf-b9bd-41ef4bb5e9c7,Alliant International University Alliant International University Fresno,Alliant International University Alliant International University Fresno,true,false,5102761,2025-05-18 18:47:29.145144+00,2025-05-18 18:47:29.145144+00,
81586eac-5d21-4ce5-8f5e-fe26c3c5d195,5bfb3e1a-58d6-4a75-9da9-a482cbdcab6d,Trinity Christian College Chicago Semester,Trinity Christian College Chicago Semester,true,false,131787,2025-05-18 20:00:26.512776+00,2025-05-18 20:00:26.512776+00,
819ea227-1f64-4245-b1e2-67692458e62e,6c51cc69-74b7-4be4-bee7-7fdc65071160,21st Century Learning Institute,21st Century Learning Institute,false,false,,2025-05-19 00:31:48.451715+00,2025-05-19 00:31:48.451715+00,
81cd627d-d289-49c1-8fde-0a33a0ccdb58,38304d1d-6383-4364-b2ab-aba1630c2aca,California Arts University California Arts University,California Arts University California Arts University,true,false,4937968,2025-05-18 20:35:19.67859+00,2025-05-18 20:35:19.67859+00,
81ded1aa-c9d4-4229-80b9-09829de3fea6,e73e5a82-fdf3-4a19-8d85-4d672be3edf8,Butte-Glenn Community College District Butte College Skyway Center,Butte-Glenn Community College District Butte College Skyway Center,true,true,1291743,2025-05-18 19:54:09.357429+00,2025-05-18 19:54:09.357429+00,
81e1f705-0c9f-4e8e-bd55-0c40e008331b,38d7dbe7-ae7a-46d1-a570-d8477d43200c,Southern Union State Community College Valley Campus,Southern Union State Community College Valley Campus,true,true,208643,2025-05-18 21:59:55.657175+00,2025-05-18 21:59:55.657175+00,
81eb01f2-3515-4cd1-bd13-0b3db580b75d,b767027d-428f-4eec-b401-6b460dc1d7a6,Massanutten Tech Ctr,Massanutten Tech Ctr,false,false,,2025-05-19 00:43:04.74162+00,2025-05-19 00:43:04.74162+00,
