id,city_id,name,campus_name,f1_certified,m1_certified,campus_id,created_at,updated_at,url
c2e84b09-4c77-400d-ab16-e96c264a9e5e,df18109a-0e1f-4e09-9068-449c9bc5f614,NORTH PIKE CAREER & TECHNICAL CENTE,NORTH PIKE CAREER & TECHNICAL CENTE,false,false,,2025-05-19 00:48:01.669818+00,2025-05-19 00:48:01.669818+00,
c31b9512-9636-44a1-a693-f9a5438db681,e4a22259-3006-4f04-bf55-264c5ea09821,Mount Mercy University CRST International Graduate Center,Mount Mercy University CRST International Graduate Center,true,false,5091874,2025-05-18 20:44:32.121057+00,2025-05-18 20:44:32.121057+00,
c32e1513-330f-4d0c-8f86-84ae69f06d2c,df95fdf8-3675-4bba-b714-e7f2036906bd,Spoon River College Spoon River College Macomb Campus,Spoon River College Spoon River College Macomb Campus,true,true,2763845,2025-05-18 22:20:13.735042+00,2025-05-18 22:20:13.735042+00,
c3b10783-1b20-41f9-9976-6800093d9c84,1fe6b135-c219-4d62-85aa-80773c9d7e68,Sacramento City College SCC West Sacramento Center,Sacramento City College SCC West Sacramento Center,true,true,139074,2025-05-18 20:59:28.810327+00,2025-05-18 20:59:28.810327+00,
c3f00244-d404-47df-b93f-681404e8a698,937dc9f8-011c-4fac-a4f6-012cddf7026a,Cameron University Cameron University - Duncan,Cameron University Cameron University - Duncan,true,true,147328,2025-05-18 21:38:33.629098+00,2025-05-18 21:38:33.629098+00,
c409af85-e650-44bb-a42a-72740ea6beac,c03e20f1-d985-419d-ac9a-8870b75771ab,PHILLIPS COMMUNITY CAREER AND TECHNICAL CENTER,PHILLIPS COMMUNITY CAREER AND TECHNICAL CENTER,false,false,,2025-05-19 00:53:29.667039+00,2025-05-19 00:53:29.667039+00,
c4304ea2-2d36-420c-8797-5e13f7057e9f,80c9c39e-b554-4048-a337-414843fa2265,SCHOOL OF ENVIRONMENTAL STUDIES,SCHOOL OF ENVIRONMENTAL STUDIES,false,false,,2025-05-19 00:42:54.273347+00,2025-05-19 00:42:54.273347+00,
c4380c74-a650-4bf1-a931-2be1e072be7d,e7ca548e-1430-4b45-aa81-42be1ec71bb7,LITERACY LEADERSHIP TECHNOLOGY ACADEMY SOUTH BAY,LITERACY LEADERSHIP TECHNOLOGY ACADEMY SOUTH BAY,false,false,,2025-05-19 00:43:44.952416+00,2025-05-19 00:43:44.952416+00,
c43b605b-38a5-4fb7-8317-4bcb05c735d3,197e5b90-5694-4486-84d8-02d7976291e7,Snow College Snow College Richfield,Snow College Snow College Richfield,true,false,29341,2025-05-18 22:24:43.282207+00,2025-05-18 22:24:43.282207+00,
c462cef9-d79b-4b0f-a558-0947bb073dbd,1c305a8c-58bb-452a-baba-4675d2fef4b0,University System of Georgia East Georgia State College - Statesboro,University System of Georgia East Georgia State College - Statesboro,true,false,1636042,2025-05-18 21:13:09.538205+00,2025-05-18 21:13:09.538205+00,
c47652d7-7bcb-4c78-b3b7-b6f298393f02,d0c64e51-f8d3-4838-8b43-ba100eb859fa,Keiser University Keiser University- Ft. Lauderdale Campus,Keiser University Keiser University- Ft. Lauderdale Campus,true,false,3518,2025-05-18 20:20:33.90311+00,2025-05-18 20:20:33.90311+00,
c48c5381-bbba-4453-9f4c-fba359648278,18635d43-7da7-40ec-8862-d3e80ba5de8c,Linn-Benton Community College Health Occupations Center,Linn-Benton Community College Health Occupations Center,true,true,5082835,2025-05-18 21:51:55.884098+00,2025-05-18 21:51:55.884098+00,
c4b4e241-bff8-4503-b30a-1b0aa45c775f,a59f60e7-dbc2-4d38-9ab2-36c9e65ca664,V.I.B.E. Academy (Virtual Institute for Brighter Education),V.I.B.E. Academy (Virtual Institute for Brighter Education),false,false,,2025-05-19 00:39:48.799533+00,2025-05-19 00:39:48.799533+00,
c4b4f438-6110-45f3-a5eb-b30f17b05988,c3f3efb0-dbba-4055-a5c8-a3057dad05e2,IS 349 MATH SCIENCE AND TECHNOLOGY,IS 349 MATH SCIENCE AND TECHNOLOGY,false,false,,2025-05-19 00:26:29.769088+00,2025-05-19 00:26:29.769088+00,
c4c7d1a1-918f-401f-8a9c-9c9e130f0367,01f472cf-0f8c-4255-977a-c60a99bd580e,The Rockefeller University The Rockefeller University,The Rockefeller University The Rockefeller University,true,false,6432,2025-05-18 19:58:54.301724+00,2025-05-18 19:58:54.301724+00,
c4cbc868-ea97-4044-9f1d-bce4fc4feca0,aa619926-5734-422f-b871-d8bf4b819d9a,Lakeland University Lakeland University Centrl WI Wis Rapids,Lakeland University Lakeland University Centrl WI Wis Rapids,true,false,97055,2025-05-18 21:47:50.81759+00,2025-05-18 21:47:50.81759+00,
c4e38a7b-0960-4f0f-bee5-0f76e0e70b02,22c18083-dd28-4b64-aa69-38ef417d5130,University of Saint Joseph University of Saint Joseph,University of Saint Joseph University of Saint Joseph,true,false,8353,2025-05-18 21:56:13.237463+00,2025-05-18 21:56:13.237463+00,
c4fc8dc0-5b30-4a93-83e7-d92bca028ab2,4c800340-e37f-4cbc-8516-52d951d5f644,LABORATORY SCHOOL OF FINANCE AND TECHNOLOGY (THE):  X223,LABORATORY SCHOOL OF FINANCE AND TECHNOLOGY (THE):  X223,false,false,,2025-05-19 00:39:52.971066+00,2025-05-19 00:39:52.971066+00,
c51ae192-903b-4525-a638-47db2b6f9a5f,60498609-fd2d-47aa-84fb-57a05d948f23,St. Petersburg College Allstate Center,St. Petersburg College Allstate Center,true,false,170988,2025-05-18 20:17:25.085226+00,2025-05-18 20:17:25.085226+00,
c53eaf33-88b4-476d-9d59-bc87d0557151,502e7f10-88de-4c11-9633-30b046d964c2,Community College of Allegheny County Allegheny Campus,Community College of Allegheny County Allegheny Campus,true,true,5148,2025-05-18 20:40:03.773086+00,2025-05-18 20:40:03.773086+00,
c5410f1b-402a-4f84-aebb-8493b8a157c5,3e6c67b7-1837-47d9-b769-6b5317bd98f3,Husson University Husson University,Husson University Husson University,true,false,1985,2025-05-18 21:26:29.521432+00,2025-05-18 21:26:29.521432+00,
c54ec60f-3c02-4625-84af-3d5d34e6327a,bdebd012-2527-48fe-8974-a658f4048df0,Frank Phillips College Frank Phillips College Rahll Campus,Frank Phillips College Frank Phillips College Rahll Campus,true,true,5158491,2025-05-18 22:44:45.713933+00,2025-05-18 22:44:45.713933+00,
c5542822-3198-4af0-ad87-a7c67a9d6c35,bf86889c-8d0b-4f97-aac2-934939be2608,New Harmony High Institute,New Harmony High Institute,false,false,,2025-05-19 00:28:31.32444+00,2025-05-19 00:28:31.32444+00,
c579e52c-a1d9-445c-ad21-68ab6602ed36,d3a66601-b249-467f-aa59-53f662fdf2a4,Prairie State College Prairie State College,Prairie State College Prairie State College,true,true,2864,2025-05-18 21:27:02.504968+00,2025-05-18 21:27:02.504968+00,
c59401d5-56d2-4e20-809b-3f28b4e2a607,901f8f07-2853-4963-8ded-d1bc6b7788ec,UNIVERSITY ACADEMY SABL INC,UNIVERSITY ACADEMY SABL INC,false,false,,2025-05-19 00:35:46.823674+00,2025-05-19 00:35:46.823674+00,
c5aba297-f87b-4958-a0e8-33ccd706c2fc,3dd6f75e-e30a-4fe8-bb1f-8448abbbdf82,Carthage College Carthage College,Carthage College Carthage College,true,false,5493,2025-05-18 21:00:19.103087+00,2025-05-18 21:00:19.103087+00,
c5c140c7-a288-4e2c-a74e-909d75363420,1cecb5f1-131c-46ce-acce-af5c1081ab91,Howard County Junior College District Howard College,Howard County Junior College District Howard College,true,true,9020,2025-05-18 21:44:45.585517+00,2025-05-18 21:44:45.585517+00,
c5d7c11a-eb06-473f-8820-1eb3be85a2b3,34c6f878-f7ac-4800-b640-9e8076d30bf9,Franklin County Career Technical Center,Franklin County Career Technical Center,false,false,,2025-05-19 00:25:03.00317+00,2025-05-19 00:25:03.00317+00,
c5e13f22-6418-4cb1-83f4-e42b323c309d,68d6c40f-cf3b-423c-b1db-72501ed014e0,Moraine Park Technical College Beaver Dam Campus,Moraine Park Technical College Beaver Dam Campus,true,false,158464,2025-05-18 22:13:58.730081+00,2025-05-18 22:13:58.730081+00,
c6128dd6-5f00-4f42-a6e3-36f7aa924fbd,2d164bce-45e5-467a-9250-232143f008ce,The Pennsylvania State University Penn State Shenango,The Pennsylvania State University Penn State Shenango,true,false,102029,2025-05-18 22:17:34.205978+00,2025-05-18 22:17:34.205978+00,
c61b5d79-a975-4599-badc-b96dfc6bee58,eb8471cd-0a9a-450a-b1eb-11c9953d05a3,Murray State College Murray State College,Murray State College Murray State College,true,false,4439,2025-05-18 22:54:06.295516+00,2025-05-18 22:54:06.295516+00,
c61fdeb1-3ddc-4084-8b83-ea5399d0d748,b14bc194-ff6b-4305-9a4e-622b74959cc2,West Los Angeles College West Los Angeles College,West Los Angeles College West Los Angeles College,true,true,7645,2025-05-18 21:04:56.045139+00,2025-05-18 21:04:56.045139+00,
c6224b06-c89a-4e86-b174-8466a70e3848,bf86889c-8d0b-4f97-aac2-934939be2608,Loyola University New Orleans Loyola University New Orleans,Loyola University New Orleans Loyola University New Orleans,true,false,6493,2025-05-18 20:11:27.903314+00,2025-05-18 20:11:27.903314+00,
c6709100-5a88-4d51-9cbf-3fa86d22d90e,9eb458c2-44e4-471a-8523-7c9b5ae64eff,SEMINARY HILLS PARK EL,SEMINARY HILLS PARK EL,false,false,,2025-05-19 00:28:52.460525+00,2025-05-19 00:28:52.460525+00,
c67f9009-5316-49aa-ac2d-e0cedf5e2ece,349a03e9-deae-466f-af2b-d5c7285c5ee8,Virginia Christian University Virginia Christian University,Virginia Christian University Virginia Christian University,true,false,87748,2025-05-18 21:52:38.933457+00,2025-05-18 21:52:38.933457+00,
c6a74770-54ca-415f-8cf7-55dcffd3f950,0ecbd347-f9d6-4ca5-8064-b8d6f0e7d5d3,America Evangelical University Western Campus,America Evangelical University Western Campus,true,false,5113874,2025-05-18 18:43:09.492247+00,2025-05-18 18:43:09.492247+00,
c6b0018a-6e53-47b1-ab0b-457f56a37e64,7253f71a-dfb6-4b0a-a94a-6df2ff406262,East Aiken School of the Arts,East Aiken School of the Arts,false,false,,2025-05-19 00:37:38.260751+00,2025-05-19 00:37:38.260751+00,
c6cad45c-2904-42f4-9474-d9df1fb774f9,77809fed-bc79-4bf8-9868-cdf9e0bf9368,Colorado Mountain College Colorado Mountain College-Leadville,Colorado Mountain College Colorado Mountain College-Leadville,true,true,8631,2025-05-18 22:12:15.165616+00,2025-05-18 22:12:15.165616+00,
c6e06697-519b-40cf-915d-9d41a5550f24,6b3074f0-4877-4ea3-801c-25fd379fa437,"Arkansas State University - Newport ASU-Newport, Marked Tree Campus","Arkansas State University - Newport ASU-Newport, Marked Tree Campus",true,false,159430,2025-05-18 22:34:24.172816+00,2025-05-18 22:34:24.172816+00,
c6fac80a-a3a6-48bf-861a-65c4f2207cd2,124404f4-8dec-4a26-a67e-04a6f42397a7,CTD - Cochise College,CTD - Cochise College,false,false,,2025-05-19 00:24:53.057058+00,2025-05-19 00:24:53.057058+00,
c6fe0225-6615-479a-8d5d-546d1abe7504,db57eb45-4de6-4db9-8ccf-90cb1cc379d1,Hoosier College and Career Academy,Hoosier College and Career Academy,false,false,,2025-05-19 00:27:05.80257+00,2025-05-19 00:27:05.80257+00,
c707c617-003a-4dae-84f4-e87da284514e,64fdb8ba-9ef2-410a-ad2b-6246d4bebb43,Middle College,Middle College,false,false,,2025-05-19 00:30:37.540641+00,2025-05-19 00:30:37.540641+00,
c716b91a-7017-4008-8c59-cefaa5cb5be9,13a39a3d-e296-4fb5-a55a-fc74a3747cd0,The Academy of Information Technology & Engineering,The Academy of Information Technology & Engineering,false,false,,2025-05-19 00:35:03.607156+00,2025-05-19 00:35:03.607156+00,
c72baf01-d544-419f-a25d-59d8ce9667be,4b5c58b1-9a08-40d2-a946-76b17d75efa3,Strayer University Newport News Campus,Strayer University Newport News Campus,true,false,5094349,2025-05-18 20:40:40.744084+00,2025-05-18 20:40:40.744084+00,
c7323eeb-f758-4c54-9fd4-5e49b4fd73bc,8044fe5d-ad2a-4b69-b60f-ce09ab47e8df,Saint Mary's College of California Saint Mary's College of California,Saint Mary's College of California Saint Mary's College of California,true,false,6517,2025-05-18 21:23:33.551107+00,2025-05-18 21:23:33.551107+00,
c74af83f-a60a-4d97-81fb-be5b2eb2b71f,dfca6ee3-c07e-443c-b32d-0c2bb4a042bf,New Mexico State University New Mexico State University,New Mexico State University New Mexico State University,true,false,8537,2025-05-18 20:32:22.95188+00,2025-05-18 20:32:22.95188+00,
c757ee27-c613-4e27-9f04-5c1bafb71936,fe3ce3cc-7a21-4457-b3c7-816d784dd382,Audubon Technology and Communication Middle,Audubon Technology and Communication Middle,false,false,,2025-05-19 00:29:24.870309+00,2025-05-19 00:29:24.870309+00,
c76888b1-8fb7-4858-8834-f4ee1ce359f5,d6594f74-c5e2-45f1-9f93-256de49e232c,Lewis University Lewis University-Main Campus,Lewis University Lewis University-Main Campus,true,false,5995,2025-05-18 21:52:45.326349+00,2025-05-18 21:52:45.326349+00,
c76e3614-10c3-47e9-b52d-49ddf740c9c7,4c800340-e37f-4cbc-8516-52d951d5f644,COLLEGIATE INSTITUTE FOR MATH AND SCIENCE,COLLEGIATE INSTITUTE FOR MATH AND SCIENCE,false,false,,2025-05-19 00:40:13.830405+00,2025-05-19 00:40:13.830405+00,
c7963ad0-b020-4f2b-8068-728d8bc9b82a,0f374301-259a-40bb-8ffc-a438a4d5bc9a,Hudson Taylor University Hudson Taylor University,Hudson Taylor University Hudson Taylor University,true,false,5046038,2025-05-18 22:01:24.034228+00,2025-05-18 22:01:24.034228+00,
c7b8765b-937b-47a1-b1cb-b2c7f2b78e08,7934a833-610a-4803-8620-360b5cde9dcf,Evergreen Valley College Evergreen Valley College,Evergreen Valley College Evergreen Valley College,true,true,8639,2025-05-18 20:14:59.625468+00,2025-05-18 20:14:59.625468+00,
c80d1f81-fa00-48e9-aa16-c83c0348371c,3ca0c172-3297-42df-8760-e004f49e3e4e,South Carolina State University South Carolina State University,South Carolina State University South Carolina State University,true,false,16517,2025-05-18 21:33:12.506281+00,2025-05-18 21:33:12.506281+00,
c80eadd9-31ae-46c7-baf8-63acd36734ae,01f472cf-0f8c-4255-977a-c60a99bd580e,The City University of New,The City University of New,true,false,4786,2025-05-18 19:58:53.193357+00,2025-05-18 19:58:53.193357+00,
c80ed149-e28c-481c-9ba9-1a4f273a4dcc,b404ed98-6d74-4fdf-bd45-21f266ef9750,Rowan College of South Jersey Rowan University - Bozorth Hall,Rowan College of South Jersey Rowan University - Bozorth Hall,true,true,5086008,2025-05-18 22:09:39.406956+00,2025-05-18 22:09:39.406956+00,
c81cef31-83d1-45da-9fa0-f71c309eaf30,c40deb43-5249-4ad3-ac27-4a2e82009424,Pontotoc Ridge Career & Tech. Cnt.,Pontotoc Ridge Career & Tech. Cnt.,false,false,,2025-05-19 00:53:43.536676+00,2025-05-19 00:53:43.536676+00,
c81dd7a4-51ee-4f6f-aaf1-0e8da60aff08,238ecc10-c546-4349-bda3-bc8516f4ebc3,Arizona State University Tucson,Arizona State University Tucson,true,false,152074,2025-05-18 18:46:33.027122+00,2025-05-18 18:46:33.027122+00,
c82e6380-6d10-4718-be60-88b486ecef3f,f07bf53d-8b06-4e89-a77e-7e1034d558d4,"Minnesota State University, Mankato Minnesota State University, Mankato","Minnesota State University, Mankato Minnesota State University, Mankato",true,true,7218,2025-05-18 21:57:57.301015+00,2025-05-18 21:57:57.301015+00,
c83ca8a3-4b17-4520-b514-7e3a63ba0b16,6b972869-3616-4193-9d9a-594fd4db95e0,Moberly Area Community College Hannibal Area Higher Education Center,Moberly Area Community College Hannibal Area Higher Education Center,true,false,139261,2025-05-18 21:43:56.151327+00,2025-05-18 21:43:56.151327+00,
c868b571-dd2b-4e9b-8926-5ffc6c753b74,ca49ab8b-be3a-4cee-9e31-871e95c274d5,Eastern Washington University EWU-Clark,Eastern Washington University EWU-Clark,true,false,4355976,2025-05-18 20:25:22.641206+00,2025-05-18 20:25:22.641206+00,
c8866cbf-8361-4565-8b0b-acba750c8616,9b9d0d61-1b75-4f7d-a584-d106dafbd62b,University of San Diego University of San Diego,University of San Diego University of San Diego,true,false,8072,2025-05-18 18:48:06.292468+00,2025-05-18 18:48:06.292468+00,
c89d22f2-92b1-4d6b-8e6a-a4690bca8363,3ba090d0-cd66-478b-8dd3-b108d36f93e8,Forsyth Technical Community College Forsyth Technical Community College,Forsyth Technical Community College Forsyth Technical Community College,true,false,77525,2025-05-18 21:19:13.504363+00,2025-05-18 21:19:13.504363+00,
c89e21a2-ad3a-4349-ad76-095c51030ed4,0ecbd347-f9d6-4ca5-8064-b8d6f0e7d5d3,Boyle Heights Sci Tech Engr and Math Magnet,Boyle Heights Sci Tech Engr and Math Magnet,false,false,,2025-05-19 00:18:16.903007+00,2025-05-19 00:18:16.903007+00,
c8ad3dcd-3523-4444-bb07-9ab45752a280,01f472cf-0f8c-4255-977a-c60a99bd580e,INSTITUTE FOR COLLABORATIVE EDUCATION,INSTITUTE FOR COLLABORATIVE EDUCATION,false,false,,2025-05-19 00:25:14.990832+00,2025-05-19 00:25:14.990832+00,
c8af4ab1-90bc-4a67-84f1-cddd8f96313f,bcff8036-afb8-4a93-a4e7-03e134850410,Dothan Technology Center,Dothan Technology Center,false,false,,2025-05-19 00:24:47.325481+00,2025-05-19 00:24:47.325481+00,
c8afa6de-3b0a-413e-a9f3-456b8b13e417,99f91c56-20f4-414a-8784-42a06eb35ebd,Tallahassee State College Ghazvini Center for Healthcare Education,Tallahassee State College Ghazvini Center for Healthcare Education,true,false,4448380,2025-05-18 20:07:49.737203+00,2025-05-18 20:07:49.737203+00,
c8c13a66-e5d0-4d04-b823-aa60fb36f888,9eb458c2-44e4-471a-8523-7c9b5ae64eff,TARRANT CO COLLEGE SOUTH/FORT WORTH COLLEGIATE H S,TARRANT CO COLLEGE SOUTH/FORT WORTH COLLEGIATE H S,false,false,,2025-05-19 00:28:54.385551+00,2025-05-19 00:28:54.385551+00,
c8e4745c-f709-4414-a96a-860cd78c8ced,42e6e4df-ceea-4c84-911d-e6e8f8e3ded0,Chester County Tech College HS - Pickering Campus,Chester County Tech College HS - Pickering Campus,false,false,,2025-05-19 00:51:37.975489+00,2025-05-19 00:51:37.975489+00,
c8e4c9e4-38fc-4d10-a66e-c999f58c64ae,6eea2ff3-33e4-4995-88dc-7bcabfa6ba6f,University of Maine University of Maine,University of Maine University of Maine,true,false,4397,2025-05-18 22:19:21.193126+00,2025-05-18 22:19:21.193126+00,
c8eea4a8-f9f7-4eec-b865-0e222d6df814,7934a833-610a-4803-8620-360b5cde9dcf,Voices College-Bound Language Academy,Voices College-Bound Language Academy,false,false,,2025-05-19 00:29:25.689545+00,2025-05-19 00:29:25.689545+00,
c905eb88-c2c0-48c6-b164-ac0309c80c83,0ecbd347-f9d6-4ca5-8064-b8d6f0e7d5d3,Communication and Tech at Diego Rivera Lrng Complex,Communication and Tech at Diego Rivera Lrng Complex,false,false,,2025-05-19 00:18:13.819083+00,2025-05-19 00:18:13.819083+00,
c91a69d3-1453-4fa0-8670-21f885a77cc0,828fc60b-274a-4707-ac24-b0c4eae3c00d,Center of Applied Technology-North,Center of Applied Technology-North,false,false,,2025-05-19 00:45:36.809665+00,2025-05-19 00:45:36.809665+00,
c91eb8be-931c-4a2f-b5c6-d6b05777d392,4218cf0e-49c1-4db5-a741-1bb7be6f3e1b,Davie County Early College High,Davie County Early College High,false,false,,2025-05-19 00:55:10.738211+00,2025-05-19 00:55:10.738211+00,
c94faabb-74da-4bb3-96d4-b39efb71a20f,765f5e54-ca7d-4ca7-bc7a-919b94f848cc,Zaytuna College Zaytuna College,Zaytuna College Zaytuna College,true,false,3831754,2025-05-18 19:54:29.544422+00,2025-05-18 19:54:29.544422+00,
c97581b6-77b9-48e8-97d8-30c4bfa0ccc1,9b9d0d61-1b75-4f7d-a584-d106dafbd62b,McGill School of Success,McGill School of Success,false,false,,2025-05-19 00:23:53.164886+00,2025-05-19 00:23:53.164886+00,
c988bb2b-f00b-457f-a6ed-9ee277096b79,566e18c9-9042-48ea-911b-b35fcc587ce7,Hinds Community College Utica Campus,Hinds Community College Utica Campus,true,true,191306,2025-05-18 21:05:45.789324+00,2025-05-18 21:05:45.789324+00,
c9920aeb-d62a-4965-84f1-f88a685065ad,11dcfe9e-83bb-4f5e-9eae-2a502e15d8b1,Saint Mary's College of California Graduate Business - Sunnyvale,Saint Mary's College of California Graduate Business - Sunnyvale,true,false,154805,2025-05-18 20:36:01.180822+00,2025-05-18 20:36:01.180822+00,
c99c8cc0-33e9-425f-88c5-728aee9b3088,e694a4cc-8ef5-49a0-8630-30913766dace,Indiana University Indiana University Kokomo,Indiana University Indiana University Kokomo,true,false,7747,2025-05-18 21:08:03.733184+00,2025-05-18 21:08:03.733184+00,
c9b35959-18ff-457a-a3c9-8260160ab39c,3dbffb4d-871e-467d-a28f-c2fa3918946f,Milpitas Middle College High,Milpitas Middle College High,false,false,,2025-05-19 00:38:27.826482+00,2025-05-19 00:38:27.826482+00,
c9beaebb-7cc1-4b9d-8a9c-d6cb3e0fdef4,765f5e54-ca7d-4ca7-bc7a-919b94f848cc,College Internship Program The Berkeley Center,College Internship Program The Berkeley Center,true,true,104222,2025-05-18 19:54:28.608529+00,2025-05-18 19:54:28.608529+00,
c9c3fa26-9491-4b66-9210-83ec3ef72eef,5cc26d36-39b4-4c9f-8173-1da44bc41afe,The University of Findlay Center for Equine & Pre-Vet. Studies,The University of Findlay Center for Equine & Pre-Vet. Studies,true,false,150111,2025-05-18 21:45:23.952229+00,2025-05-18 21:45:23.952229+00,
c9d70fd8-f2d2-4dd7-9bb6-45bdc52a5a2e,9b9d0d61-1b75-4f7d-a584-d106dafbd62b,National University / San Diego San Diego,National University / San Diego San Diego,true,false,8625,2025-05-18 18:48:02.497608+00,2025-05-18 18:48:02.497608+00,
ca025a18-4a5e-4f8b-946c-b33ef502086d,2b6fb942-b976-4079-a934-070e28ffe61a,Ivy Tech Community College of Indiana Ivy Tech Comm Coll-Lake County Gary,Ivy Tech Community College of Indiana Ivy Tech Comm Coll-Lake County Gary,true,true,6044,2025-05-18 20:43:47.387809+00,2025-05-18 20:43:47.387809+00,
ca177df1-1895-4927-8ea1-780cf8f68bec,02032e78-b0e0-45ed-b651-132d937b8ea4,San Bernardino Community College District Crafton Hills College,San Bernardino Community College District Crafton Hills College,true,false,3451,2025-05-18 21:45:17.603088+00,2025-05-18 21:45:17.603088+00,
ca36bf66-f85f-43de-9e8a-e021f4ecdabe,20e30b2f-f5fc-41d4-8e58-c9bf0ca0e15a,COLLEGE PARK MIDDLE,COLLEGE PARK MIDDLE,false,false,,2025-05-19 00:30:07.725754+00,2025-05-19 00:30:07.725754+00,
ca52f509-5cb8-4190-b546-d9d15ff9ed3b,88b8028c-645d-4507-890b-74ff1b71b2fb,Shawnee State University Shawnee State University,Shawnee State University Shawnee State University,true,false,1293,2025-05-18 21:06:14.434462+00,2025-05-18 21:06:14.434462+00,
ca72d11d-1784-4688-a104-0f5a1953ff18,4762b53f-6ca6-48eb-88e9-1c951d6b6ba7,Edison State Community College Piqua,Edison State Community College Piqua,true,false,10481,2025-05-18 21:44:16.428947+00,2025-05-18 21:44:16.428947+00,
ca740615-8b2e-4959-8007-3e640f36c97b,9b9d0d61-1b75-4f7d-a584-d106dafbd62b,Woodbury University Woodbury University-San Diego,Woodbury University Woodbury University-San Diego,true,false,8750,2025-05-18 18:48:06.597845+00,2025-05-18 18:48:06.597845+00,
ca987d88-9a9a-4861-acd0-21e82f8dfa71,493ae846-850c-405d-a25f-914e44bf618e,COLLEGE PARK ELEM,COLLEGE PARK ELEM,false,false,,2025-05-19 00:49:13.19625+00,2025-05-19 00:49:13.19625+00,
caf5fcb3-49d7-45d3-bb8a-5aef3dac22b9,5bfb3e1a-58d6-4a75-9da9-a482cbdcab6d,Chicago Public Schools Jones College Preparatory High School,Chicago Public Schools Jones College Preparatory High School,true,false,183834,2025-05-18 20:00:06.415006+00,2025-05-18 20:00:06.415006+00,
cb111729-a123-4591-81f1-f086a4921c9b,5bfb3e1a-58d6-4a75-9da9-a482cbdcab6d,Mosaic School of Fine Arts,Mosaic School of Fine Arts,false,false,,2025-05-19 00:25:35.769657+00,2025-05-19 00:25:35.769657+00,
cb14d640-616a-4218-8b7f-e14546c74a66,49065d66-8fc8-4dd4-9cd9-06819603bdb5,Desert Community College District College of the Desert,Desert Community College District College of the Desert,true,false,7261,2025-05-18 21:01:18.365585+00,2025-05-18 21:01:18.365585+00,
cb43f406-1152-408b-a258-0c80d9ca77c3,c927d744-4a45-4147-a31f-148de91c85f3,NOXUBEE CO VOC TECH,NOXUBEE CO VOC TECH,false,false,,2025-05-19 00:35:59.081552+00,2025-05-19 00:35:59.081552+00,
cb606edd-fb22-4777-9426-0de285feb0ea,009ad6d2-23f0-437e-8163-7370009e7d1b,Seattle Colleges South Seattle College,Seattle Colleges South Seattle College,true,true,5102793,2025-05-18 20:09:45.702636+00,2025-05-18 20:09:45.702636+00,
cb6429af-56a2-49de-bcb5-224079bc91c7,9b0fe162-a86e-430a-99d8-7da9d060e4ae,South Dakota State University University Center- Rapid City,South Dakota State University University Center- Rapid City,true,false,142701,2025-05-18 20:53:03.256871+00,2025-05-18 20:53:03.256871+00,
cb8ec07c-7a40-450a-b7f2-2f5279c57499,5c19a87b-dd6c-4140-b861-4b36889c0ffe,Loyola University Maryland Loyola University Maryland,Loyola University Maryland Loyola University Maryland,true,false,6269,2025-05-18 20:13:02.696887+00,2025-05-18 20:13:02.696887+00,
cb9f5bed-42dd-4402-8a69-a1a0450bbd48,ae9b81f3-126e-4f12-93ea-c0412dbef015,Lorain County Community College Lorain County Community College,Lorain County Community College Lorain County Community College,true,false,5037,2025-05-18 21:21:41.638912+00,2025-05-18 21:21:41.638912+00,
cbb379b5-a216-4a3c-a778-32fc9ba558cf,229f0d6a-1b83-4d16-8649-7622821eacfb,King University King University Hardin Valley Campus,King University King University Hardin Valley Campus,true,false,582250,2025-05-18 20:46:05.499797+00,2025-05-18 20:46:05.499797+00,
cbbee061-0929-4f4d-9b82-da3468aef0f6,56338fe5-d3fc-41af-8da5-734481c263b7,Arkansas Baptist College Arkansas Baptist College,Arkansas Baptist College Arkansas Baptist College,true,false,38072,2025-05-18 18:45:36.95415+00,2025-05-18 18:45:36.95415+00,
cbcb4ca2-de4d-47fc-a714-d1c8ab604a17,f2c54b37-99e0-4f82-b0eb-063f8b937185,Warner University Warner University,Warner University Warner University,true,false,12226,2025-05-18 21:32:23.055831+00,2025-05-18 21:32:23.055831+00,
cbf603e8-79ea-4413-82f0-22404f1853c8,0ecbd347-f9d6-4ca5-8064-b8d6f0e7d5d3,University Pathways Public Service Academy,University Pathways Public Service Academy,false,false,,2025-05-19 00:18:17.867745+00,2025-05-19 00:18:17.867745+00,
cbfd73ce-9949-4ddc-8e9b-df7c03d061a4,5bfb3e1a-58d6-4a75-9da9-a482cbdcab6d,"University of Illinois MCS Chicago Program, UIUC","University of Illinois MCS Chicago Program, UIUC",true,false,5195164,2025-05-18 20:00:27.113253+00,2025-05-18 20:00:27.113253+00,
cc06fec8-ae1e-4344-aae2-5f7ee996d079,3040ca0f-8e86-4de4-b246-6459c6591a64,Kentucky TECH - Madisonville Reg Tech Ct,Kentucky TECH - Madisonville Reg Tech Ct,false,false,,2025-05-19 00:50:37.420446+00,2025-05-19 00:50:37.420446+00,
cc07ac8c-9b89-4cf5-9410-a6d7840ff51b,ce503a7c-0f47-4f0b-98a4-dc407f369692,The Pennsylvania State University Penn State College of Medicine,The Pennsylvania State University Penn State College of Medicine,true,false,102035,2025-05-18 22:18:03.348524+00,2025-05-18 22:18:03.348524+00,
cc1128f0-b5c6-435d-b3f7-9cc92108614f,bafac60d-b3c0-45eb-af5d-0703c04d493e,Stanford University Stanford University,Stanford University Stanford University,true,false,7892,2025-05-18 21:47:56.491475+00,2025-05-18 21:47:56.491475+00,
cc27d682-4620-4695-966c-c8206f73bad9,bf650a6c-cc0a-41ec-a4e5-e3619b8a0f6d,The University of Texas at Dallas Collin Higher Education Center,The University of Texas at Dallas Collin Higher Education Center,true,false,147268,2025-05-18 21:17:17.837281+00,2025-05-18 21:17:17.837281+00,
