id,city_id,name,campus_name,f1_certified,m1_certified,campus_id,created_at,updated_at,url
3dc28292-0ad0-4e87-aa0a-e50c223e1e10,9260d8c1-bd1d-49d2-bf13-56d57e897ec0,Early College Academy,Early College Academy,false,false,,2025-05-19 00:30:53.331518+00,2025-05-19 00:30:53.331518+00,
3dfd7683-a741-46e0-9a04-d418b8b4d1ab,25fc1290-1114-4fb4-91ba-1cce85227e1c,The Pennsylvania State University Penn State Brandywine,The Pennsylvania State University Penn State Brandywine,true,false,102003,2025-05-18 22:55:24.197829+00,2025-05-18 22:55:24.197829+00,
3e001ddc-a8e8-4798-9507-30d653e8ebdd,5bfb3e1a-58d6-4a75-9da9-a482cbdcab6d,Northern Illinois University NIU Chicago,Northern Illinois University NIU Chicago,true,false,3166745,2025-05-18 20:00:14.182039+00,2025-05-18 20:00:14.182039+00,
3e18f4fe-63c8-47d8-9247-8853250ec273,9ccccf95-e593-4294-b098-d3a099e5a509,Green River College Green River College Enumclaw Campus,Green River College Green River College Enumclaw Campus,true,true,142365,2025-05-18 22:05:05.038631+00,2025-05-18 22:05:05.038631+00,
3e1fa0ca-776d-4f9c-8ea8-42145c8eccd0,ce2a86db-089e-408a-b32f-a76fc86b8c01,Texas Tech University System Texas Tech University Health Sciences Ce,Texas Tech University System Texas Tech University Health Sciences Ce,true,false,5131183,2025-05-18 20:08:26.413629+00,2025-05-18 20:08:26.413629+00,
3e229a56-f58b-469d-9d93-2f014b3ccf12,49f0fe19-ebf6-477b-9c85-8956755f7bc5,Massachusetts College of Liberal Arts Massachusetts College of Liberal Arts,Massachusetts College of Liberal Arts Massachusetts College of Liberal Arts,true,false,4766,2025-05-18 22:21:18.988048+00,2025-05-18 22:21:18.988048+00,
3e2841ef-cc0c-496e-9c7c-d73a6222fda4,9cfbdda8-1310-4b9e-96bc-23cd90da6078,Western Washington University WWU - Bremerton,Western Washington University WWU - Bremerton,true,false,5164716,2025-05-18 20:53:17.667594+00,2025-05-18 20:53:17.667594+00,
3e4fcc6e-a26d-4e06-900e-921405f3a232,24f8a8a0-df4c-40a9-9196-7c2c841fd7ab,College View Elementary,College View Elementary,false,false,,2025-05-19 00:39:49.202615+00,2025-05-19 00:39:49.202615+00,
3e53d04c-4f41-493d-b488-5b3f1359fc54,8c1395f2-a4e6-4f5a-936a-96e9ff0e006a,VILLAGE TECH SCHOOLS,VILLAGE TECH SCHOOLS,false,false,,2025-05-19 00:41:44.743155+00,2025-05-19 00:41:44.743155+00,
3e5d45ce-883f-466e-8645-53ff638db0b0,f90afd16-85a6-4601-8200-d1dee4e0e541,"UCNJ Union College of Union County, NJ UCNJ Elizabeth","UCNJ Union College of Union County, NJ UCNJ Elizabeth",true,false,17840,2025-05-18 21:06:35.307978+00,2025-05-18 21:06:35.307978+00,
3e77a180-e563-4d25-be93-95906ff7dfd2,e27bba06-d85c-47a4-abf2-1ccc482412ed,Strayer University Virginia Beach Campus,Strayer University Virginia Beach Campus,true,false,5094350,2025-05-18 20:41:15.106271+00,2025-05-18 20:41:15.106271+00,
3e8a320b-ae26-43f7-9533-d5c594969733,01f472cf-0f8c-4255-977a-c60a99bd580e,The City University of New,The City University of New,true,false,3690449,2025-05-18 19:58:52.879487+00,2025-05-18 19:58:52.879487+00,
3e93d68c-c7bb-454a-8678-7469e4d6475f,05dbea37-3e23-4495-80b3-34cde2fdf314,Sul Ross State University Rio Grande College Uvalde Center,Sul Ross State University Rio Grande College Uvalde Center,true,false,2736150,2025-05-18 21:41:02.003338+00,2025-05-18 21:41:02.003338+00,
3ea71e78-2dbc-4cb9-a3d1-75b543f3f8e6,8468c10b-8a07-4e8b-9720-21696a4b7460,CAREER & TECHNICAL CENTER,CAREER & TECHNICAL CENTER,false,false,,2025-05-19 00:48:16.923064+00,2025-05-19 00:48:16.923064+00,
3eb43ba8-9652-4988-9856-1db4c63a77e7,2638ef7f-d52d-43d1-85f5-485b54576019,Stevens Institute of Technology Stevens Institute of Technology,Stevens Institute of Technology Stevens Institute of Technology,true,false,1111,2025-05-18 21:26:26.644309+00,2025-05-18 21:26:26.644309+00,
3ebd1823-4591-4d50-a7a5-9cfae4d1dc81,45849ea2-0cf4-4501-9be2-4b9d77354ddf,Oakton Community College Skokie Campus,Oakton Community College Skokie Campus,true,false,132123,2025-05-18 21:26:40.997902+00,2025-05-18 21:26:40.997902+00,
3ec3a5c4-8553-42d3-a3e1-24c5a953cfed,32b929e9-b487-418d-87b6-dbcf6fb2d78f,San Luis Obispo Community College District Cuesta College,San Luis Obispo Community College District Cuesta College,true,true,8686,2025-05-18 19:56:59.192305+00,2025-05-18 19:56:59.192305+00,
3eecaad0-8854-4ffa-a663-7862f7c16d5d,238ecc10-c546-4349-bda3-bc8516f4ebc3,Pima County Community College District Pima Community College,Pima County Community College District Pima Community College,true,false,1062,2025-05-18 18:46:33.498606+00,2025-05-18 18:46:33.498606+00,
3f0f99b1-268e-4536-9053-01d410b4f23c,5523831b-4350-4696-8059-45a98affd2ad,Lawrence County Career Technical Center,Lawrence County Career Technical Center,false,false,,2025-05-19 00:52:57.350079+00,2025-05-19 00:52:57.350079+00,
3f1920d4-1980-4ed0-ad08-293decc8545e,18cfb948-3453-4e58-b3d1-38af831a40a4,"University of Washington, Bothell Bothell","University of Washington, Bothell Bothell",true,false,6598,2025-05-18 21:15:36.119569+00,2025-05-18 21:15:36.119569+00,
3f282d4e-2d03-4d59-a652-2679a8ddc9b2,5cc26d36-39b4-4c9f-8173-1da44bc41afe,The University of Findlay All Hazards Training Center (AHTC),The University of Findlay All Hazards Training Center (AHTC),true,false,150113,2025-05-18 21:45:23.636569+00,2025-05-18 21:45:23.636569+00,
3f338235-4245-42cb-96c3-e8c1e3c816e2,2126deb4-3c7c-4d6c-a97b-e099ac07aeef,Salt Lake Community College Jordan Campus,Salt Lake Community College Jordan Campus,true,true,97141,2025-05-18 20:52:54.072842+00,2025-05-18 20:52:54.072842+00,
3f3a8b3b-d4be-413a-a31c-0ea53195ab25,14215099-e571-4757-9d4c-10db68786d43,PSJA NORTH EARLY COLLEGE H S,PSJA NORTH EARLY COLLEGE H S,false,false,,2025-05-19 00:41:37.235384+00,2025-05-19 00:41:37.235384+00,
3f405795-e719-4dd9-8a28-3e8f7316a9b3,d8140b2f-9aea-45f0-bc05-d6d793398827,Pittsburg State University Pittsburg State University,Pittsburg State University Pittsburg State University,true,false,7699,2025-05-18 21:22:46.246419+00,2025-05-18 21:22:46.246419+00,
3f55190e-19a9-47ec-a6af-0c58283337a8,d35c12c0-e379-492b-bc6b-d45914b15f6a,Caperton Center For Applied Technology,Caperton Center For Applied Technology,false,false,,2025-05-19 00:39:18.610094+00,2025-05-19 00:39:18.610094+00,
3f5996db-9148-4918-ab53-eec1f6641a16,b7922d0d-d263-4140-8248-c6310da42a5b,Rochester University Rochester University,Rochester University Rochester University,true,false,4603876,2025-05-18 20:38:45.255507+00,2025-05-18 20:38:45.255507+00,
3f73d152-9373-4086-bf3c-f98d1445f275,db57eb45-4de6-4db9-8ccf-90cb1cc379d1,Martin University Martin University,Martin University Martin University,true,false,17937,2025-05-18 20:06:13.044529+00,2025-05-18 20:06:13.044529+00,
3f7528f3-6282-47c1-a6bd-4fae29eb9190,7065ee00-c41b-45b5-98e9-34daa53fd9f5,PROMISE College and Career Academy,PROMISE College and Career Academy,false,false,,2025-05-19 00:34:54.887705+00,2025-05-19 00:34:54.887705+00,
3f800c11-718b-4079-a914-fbff72f5ab97,197e9a60-1bca-4e30-bf6f-93b8fe0bc975,California State University Channel Islands CSU Channel Islands Goleta/Santa Barbara,California State University Channel Islands CSU Channel Islands Goleta/Santa Barbara,true,false,135253,2025-05-18 20:37:54.268352+00,2025-05-18 20:37:54.268352+00,
3f9144b1-9ec3-4978-a6e6-e42e979e7b5b,c0a6f4a8-b388-421c-a322-1c7dfd060cec,Johnston Co Early College Academy,Johnston Co Early College Academy,false,false,,2025-05-19 00:49:29.886416+00,2025-05-19 00:49:29.886416+00,
3fb4195f-e2c4-49f9-b190-eeefbdfbbdff,07d6b90a-f9a3-41ae-b704-dfb9936e10ba,North Baldwin Center For Technology,North Baldwin Center For Technology,false,false,,2025-05-19 00:25:11.857478+00,2025-05-19 00:25:11.857478+00,
3fb74105-89ae-4f4e-8b4c-e5ffb55e950d,6dbc92f3-c968-45f7-ae14-116d80c32f16,University School University School-Shaker Campus,University School University School-Shaker Campus,true,false,9513,2025-05-18 22:12:45.093882+00,2025-05-18 22:12:45.093882+00,
3fcfd4a1-d539-4715-bf7a-4ce72c93211f,5f917017-8be3-4972-8bc9-e2f99c4e5261,The City University of New,The City University of New,true,false,5727,2025-05-18 21:56:52.072556+00,2025-05-18 21:56:52.072556+00,
3fe1942f-b3ba-40e1-bb94-531385ddd6ff,01f472cf-0f8c-4255-977a-c60a99bd580e,"Fashion Institute of Technology, State University of N","Fashion Institute of Technology, State University of N",true,false,4825,2025-05-18 19:58:49.17983+00,2025-05-18 19:58:49.17983+00,
3feedff0-cffe-4c51-b390-277cc32d51e3,e27bba06-d85c-47a4-abf2-1ccc482412ed,Regent University Regent University,Regent University Regent University,true,false,8694,2025-05-18 20:41:14.800259+00,2025-05-18 20:41:14.800259+00,
3ff5532b-9988-4ca7-88bc-38fbd8de6f21,9b9d0d61-1b75-4f7d-a584-d106dafbd62b,SDSU Global Campus San Diego State University,SDSU Global Campus San Diego State University,true,false,1236,2025-05-18 18:48:05.358735+00,2025-05-18 18:48:05.358735+00,
4027775d-c054-4b2b-8ada-83e72718fc20,dca3916d-aa18-43a3-9a70-10d75b9d6341,College Hill Fundamental Academy,College Hill Fundamental Academy,false,false,,2025-05-19 00:31:58.245063+00,2025-05-19 00:31:58.245063+00,
4028ec2a-c354-48af-86c3-64c66d2011c2,229f0d6a-1b83-4d16-8649-7622821eacfb,The University of Tennessee Health Science Center University of Tennessee Medical Center,The University of Tennessee Health Science Center University of Tennessee Medical Center,true,false,97100,2025-05-18 20:46:07.955034+00,2025-05-18 20:46:07.955034+00,
4029b2d6-3c1e-4bbc-89db-294dcd5ca29a,3debb6c3-b217-4c86-93c9-d207e7d78df6,ECHO PARK LEADERSHIP ENGINEER/TECH,ECHO PARK LEADERSHIP ENGINEER/TECH,false,false,,2025-05-19 00:43:36.001235+00,2025-05-19 00:43:36.001235+00,
40499062-a1a5-4a49-a85e-a5c17a1887b7,370bada4-9cd2-49a4-810f-67e07085c9b4,Inver Hills Community College Inver Hills Community College,Inver Hills Community College Inver Hills Community College,true,false,6089,2025-05-18 21:29:04.881283+00,2025-05-18 21:29:04.881283+00,
40553314-49bc-44c9-8323-e9c3afa8192e,2d61696f-d47e-45f6-8656-3896c6903687,FORT MYERS TECHNICAL COLLEGE,FORT MYERS TECHNICAL COLLEGE,false,false,,2025-05-19 00:35:52.717665+00,2025-05-19 00:35:52.717665+00,
407b216d-640f-4fed-bd72-df5ab7ddf95a,23e64cc7-6cbb-483d-aecc-a2c4ea42dad1,California Miramar University California Miramar University La Puente,California Miramar University California Miramar University La Puente,true,false,4932928,2025-05-18 21:05:13.98257+00,2025-05-18 21:05:13.98257+00,
4086359a-208b-4b33-9149-83f1c31efe6c,b14bc194-ff6b-4305-9a4e-622b74959cc2,Emperor's College of Traditional Oriental Medicine Emperor's College of Traditional Orienta,Emperor's College of Traditional Oriental Medicine Emperor's College of Traditional Orienta,true,false,3847,2025-05-18 21:04:55.729767+00,2025-05-18 21:04:55.729767+00,
40934041-f93a-4a96-862c-bf0769495e90,b7922d0d-d263-4140-8248-c6310da42a5b,College Park Elementary,College Park Elementary,false,false,,2025-05-19 00:33:45.369412+00,2025-05-19 00:33:45.369412+00,
409bb73d-98ce-4ae6-b5de-a7231c449700,021d06cf-be59-44b0-af9f-f0fa133ffe48,College of Central Florida Hampton Center,College of Central Florida Hampton Center,true,true,134813,2025-05-18 20:47:07.28681+00,2025-05-18 20:47:07.28681+00,
40ae3596-8d40-47fd-a1ef-fffbcce7aee7,4c800340-e37f-4cbc-8516-52d951d5f644,URBAN INSTITUTE OF MATHEMATICS,URBAN INSTITUTE OF MATHEMATICS,false,false,,2025-05-19 00:39:56.659308+00,2025-05-19 00:39:56.659308+00,
40b9736e-f670-43b2-ad8e-73e522330327,122995c2-1ca1-41aa-8290-691da95677ae,School of Leaders for PS Secondary,School of Leaders for PS Secondary,false,false,,2025-05-19 00:29:47.936201+00,2025-05-19 00:29:47.936201+00,
40c45a55-6605-4477-98f5-4e6960bb322b,94f99a95-2389-4bba-9163-a09e1165350b,Modesto Junior College Modesto Junior College,Modesto Junior College Modesto Junior College,true,true,6397,2025-05-18 20:37:05.755111+00,2025-05-18 20:37:05.755111+00,
40d49a13-6db4-48f8-81bb-717143d0a368,9b9d0d61-1b75-4f7d-a584-d106dafbd62b,California Miramar University California Miramar University - San Dieg,California Miramar University California Miramar University - San Dieg,true,false,122914,2025-05-18 18:48:01.195351+00,2025-05-18 18:48:01.195351+00,
40e484c8-6482-4e35-8d82-17aa16b7288f,3ba090d0-cd66-478b-8dd3-b108d36f93e8,Middle College of Forsyth Cnty,Middle College of Forsyth Cnty,false,false,,2025-05-19 00:41:55.654075+00,2025-05-19 00:41:55.654075+00,
40e9492b-6158-4779-a019-a1d55f25a39b,0b281f82-78ef-4293-ac21-1f1bc8946b01,STATE COLLEGE OF FLORIDA COLLEGIATE SCHOOL,STATE COLLEGE OF FLORIDA COLLEGIATE SCHOOL,false,false,,2025-05-19 00:36:14.146829+00,2025-05-19 00:36:14.146829+00,
40f22637-9e0d-4217-a17c-866fad1c8602,f33eaca6-a094-438e-9530-086afa4cc130,Madonna University Madonna University,Madonna University Madonna University,true,false,4457,2025-05-18 21:11:25.268366+00,2025-05-18 21:11:25.268366+00,
40f9894d-7e45-48c4-a817-f9a673b244ed,c0b47dd8-e78e-4591-b011-77d3f5365f98,Eastern New Mexico University Eastern New Mexico University-Roswell,Eastern New Mexico University Eastern New Mexico University-Roswell,true,false,5825,2025-05-18 20:48:11.897457+00,2025-05-18 20:48:11.897457+00,
410ac0b7-f3f7-42a7-a779-c96663eba123,73674253-a9c0-4721-ab9b-d246a17a6582,University of North Carolina at Charlotte Univ. of North Carolina at Charlotte,University of North Carolina at Charlotte Univ. of North Carolina at Charlotte,true,false,7855,2025-05-18 20:10:53.613889+00,2025-05-18 20:10:53.613889+00,
4138bd82-d66d-4339-94ca-a1ee81cc29d4,313ee268-3e6a-443f-858a-8913ce6a9672,Austin Community College Cypress Creek Campus,Austin Community College Cypress Creek Campus,true,true,98472,2025-05-18 21:18:15.128598+00,2025-05-18 21:18:15.128598+00,
41450cd5-eb9d-4bf5-b755-5d91b276c852,01f472cf-0f8c-4255-977a-c60a99bd580e,The City University of New,The City University of New,true,false,143465,2025-05-18 19:58:53.349159+00,2025-05-18 19:58:53.349159+00,
415b0ecb-e65b-47ff-a658-fd655c3048b8,009ad6d2-23f0-437e-8163-7370009e7d1b,Seattle University Seattle University,Seattle University Seattle University,true,false,9207,2025-05-18 20:09:46.410585+00,2025-05-18 20:09:46.410585+00,
41656d61-38e1-479a-917b-90db09583422,190ef938-5791-4ad5-b8d1-07b1a95b24f9,Owensboro Technical College,Owensboro Technical College,false,false,,2025-05-19 00:37:56.306882+00,2025-05-19 00:37:56.306882+00,
41730976-b59b-4271-b3c8-6a68a58f08f0,125f7247-3d6e-408c-9d92-a02046887d1e,University of St. Francis University of St. Francis - Albuquerque,University of St. Francis University of St. Francis - Albuquerque,true,false,5138366,2025-05-18 18:45:58.504112+00,2025-05-18 18:45:58.504112+00,
4198ac38-62e6-44e7-a9e2-6d72c74b2369,a59c73fa-abe4-4e45-93a8-a0f14e945fad,Messiah University Messiah University,Messiah University Messiah University,true,false,157,2025-05-18 22:17:49.529662+00,2025-05-18 22:17:49.529662+00,
419c60c2-afe2-4ad4-87ae-de43f917ba5f,814838c0-d2b3-4550-a415-9142e585e0a8,Westchester Community College Peekskill Center for the Digital Arts,Westchester Community College Peekskill Center for the Digital Arts,true,false,174126,2025-05-18 22:16:27.071945+00,2025-05-18 22:16:27.071945+00,
41a168ac-253f-4917-a107-b31e2373f70a,06ad001c-32e2-4496-9312-9c6c3c8e6278,Ithaca College Ithaca College,Ithaca College Ithaca College,true,false,1861,2025-05-18 21:08:42.902075+00,2025-05-18 21:08:42.902075+00,
41a2387e-b152-4534-83ed-fa9df9c752cd,3a0cdb5f-8fc1-4d78-b28e-c320ddbad029,Walden University Walden University,Walden University Walden University,true,false,132920,2025-05-18 20:45:11.537733+00,2025-05-18 20:45:11.537733+00,
41c9d309-0ef3-49fd-930c-b95e3117cee2,823bc759-5b27-47ce-aa6f-9396333497bb,Saint Francis Medical Center College of Nursing Saint Francis Medical Center College of,Saint Francis Medical Center College of Nursing Saint Francis Medical Center College of,true,false,16947,2025-05-18 20:34:20.037173+00,2025-05-18 20:34:20.037173+00,
41d9f2c7-9611-46e0-ae0e-bd492f15bb09,34facc4e-9009-4cee-b453-1f96ccf004f7,Indiana State University Indiana State University,Indiana State University Indiana State University,true,false,8822,2025-05-18 20:57:59.442038+00,2025-05-18 20:57:59.442038+00,
41ebcb33-0c39-43fc-b614-e31947b8a393,877c3132-d65e-477f-b782-6e2c0a0f5bbb,Savannah College of Art and Design SCAD Atlanta,Savannah College of Art and Design SCAD Atlanta,true,false,48492,2025-05-18 20:05:11.901126+00,2025-05-18 20:05:11.901126+00,
41f107bf-ebfc-4e23-a753-780a5a6a767d,55faf34f-e5e5-444a-a0db-92fedba0ec2c,Academy of Art University Academy of Art University9,Academy of Art University Academy of Art University9,true,false,806743,2025-05-18 19:52:28.320884+00,2025-05-18 19:52:28.320884+00,
41f2386a-6cd6-4989-9724-d36a5e4fd215,7b936670-8e27-4f48-9e9f-1b012df71bfc,New Tech High - Zion-Benton East,New Tech High - Zion-Benton East,false,false,,2025-05-19 00:47:38.188621+00,2025-05-19 00:47:38.188621+00,
42157b78-d312-4cac-b157-0f3b1b8b270d,5c19a87b-dd6c-4140-b861-4b36889c0ffe,The Johns Hopkins University: Medical Institutions The Johns Hopkins Medical Institutions,The Johns Hopkins University: Medical Institutions The Johns Hopkins Medical Institutions,true,false,874,2025-05-18 20:13:04.911476+00,2025-05-18 20:13:04.911476+00,
422f426f-2762-4d08-ba30-826a535bd9a9,615ad56b-1a8b-4bd5-b8f2-25532b36064e,Franciscan University of Steubenville Franciscan University of Steubenville,Franciscan University of Steubenville Franciscan University of Steubenville,true,false,8373,2025-05-18 21:45:32.964294+00,2025-05-18 21:45:32.964294+00,
4278e37d-a642-4ea5-ad13-dfccce542d4c,d52ae451-6f08-4258-8735-e0d330cc9d26,Southern University Laboratory Virtual School,Southern University Laboratory Virtual School,false,false,,2025-05-19 00:28:32.645598+00,2025-05-19 00:28:32.645598+00,
42844b1d-fea4-4eda-9e04-e9185ae2158e,9260d8c1-bd1d-49d2-bf13-56d57e897ec0,University Schools,University Schools,false,false,,2025-05-19 00:30:51.649006+00,2025-05-19 00:30:51.649006+00,
42862b0b-46f6-43d4-81a6-efb03d2af03a,ce2a86db-089e-408a-b32f-a76fc86b8c01,El Paso Community College District Transmountain Campus,El Paso Community College District Transmountain Campus,true,false,175788,2025-05-18 20:08:25.679454+00,2025-05-18 20:08:25.679454+00,
4294a17d-c2e0-47c3-bbf8-8cb12db5fb0d,125f7247-3d6e-408c-9d92-a02046887d1e,University of New Mexico University of New Mexico,University of New Mexico University of New Mexico,true,false,6907,2025-05-18 18:45:58.31876+00,2025-05-18 18:45:58.31876+00,
42bc5226-cc20-4d99-bf7b-7dbe2f2d1260,20e30b2f-f5fc-41d4-8e58-c9bf0ca0e15a,Orange County Public Schools - Career & Technical Education Orange Technical College South Campus,Orange County Public Schools - Career & Technical Education Orange Technical College South Campus,false,true,209957,2025-05-18 20:19:12.564614+00,2025-05-18 20:19:12.564614+00,
42c13286-8df5-4157-a455-9a915a0e8965,0f670bdd-993e-46a1-9a14-1b9ab8f369e0,Medical College of Wisconsin MCW Green Bay,Medical College of Wisconsin MCW Green Bay,true,false,2898551,2025-05-18 22:14:32.756642+00,2025-05-18 22:14:32.756642+00,
42f6d0d4-8760-472c-8187-441125d96a6b,ef062e20-cd03-4a04-bc3a-83663583c5a8,Casa Loma College Casa Loma College,Casa Loma College Casa Loma College,true,false,5143423,2025-05-18 21:22:27.840067+00,2025-05-18 21:22:27.840067+00,
430527ce-26ee-4547-84e3-1b8ed42ff26d,b81d2a43-066f-4f63-84ce-1cc9675c8f0b,Vern Riffe Career Technology C,Vern Riffe Career Technology C,false,false,,2025-05-19 00:54:56.128483+00,2025-05-19 00:54:56.128483+00,
4334155d-ae84-4052-9344-e30bf56b7258,d422c277-5e0e-4314-8fa6-ee7376e197ad,South Baldwin Center For Technology,South Baldwin Center For Technology,false,false,,2025-05-19 00:52:58.552891+00,2025-05-19 00:52:58.552891+00,
4392ae10-7a90-4ff6-9162-66e4323ea888,20e30b2f-f5fc-41d4-8e58-c9bf0ca0e15a,University of Florida CityLab Orlando,University of Florida CityLab Orlando,true,false,5084667,2025-05-18 20:19:14.320263+00,2025-05-18 20:19:14.320263+00,
43a8b482-b653-4634-a1b9-3022fb59fba8,1c0e6b51-2f1c-40e5-9f7c-b3efe3ab62ff,University of Arizona UA Oro Valley-Hanley,University of Arizona UA Oro Valley-Hanley,true,false,5127274,2025-05-18 22:13:08.86393+00,2025-05-18 22:13:08.86393+00,
43b4e836-e12c-43a3-bc97-2f1b8bfcbb24,01f472cf-0f8c-4255-977a-c60a99bd580e,Columbia University in the City of New,Columbia University in the City of New,true,false,8723,2025-05-18 19:58:47.875928+00,2025-05-18 19:58:47.875928+00,
44006390-bc10-4ad8-a2b3-91ea20e085b1,da110244-26a9-46f3-806d-3da230e77177,Limestone University Limestone University,Limestone University Limestone University,true,false,3611,2025-05-18 21:42:20.181556+00,2025-05-18 21:42:20.181556+00,
4402b8be-666a-4a3a-b1b7-e80b4a7b8f09,97276f61-6bc7-40a2-983b-c7559cc3a564,Clemson University Clemson University,Clemson University Clemson University,true,false,893,2025-05-18 21:18:50.236984+00,2025-05-18 21:18:50.236984+00,
44063191-ad1a-496f-8737-af67567bd6cc,5bfb3e1a-58d6-4a75-9da9-a482cbdcab6d,City Colleges of Chicago Wright College,City Colleges of Chicago Wright College,true,false,7306,2025-05-18 20:00:08.500432+00,2025-05-18 20:00:08.500432+00,
4447e8d1-97f0-4075-8fcc-12390c28515b,da110244-26a9-46f3-806d-3da230e77177,Spartanburg Community College SCC Cherokee County Campus,Spartanburg Community College SCC Cherokee County Campus,true,false,151540,2025-05-18 21:42:20.341106+00,2025-05-18 21:42:20.341106+00,
444df23b-3271-4dba-bde4-e5f0e34091cb,5a2f210b-c079-435e-88ae-2ab30c33ea6d,"Rutgers, the State University of New Jersey Rutgers-New Brunswick/undergraduate","Rutgers, the State University of New Jersey Rutgers-New Brunswick/undergraduate",true,false,7451,2025-05-18 21:10:14.481631+00,2025-05-18 21:10:14.481631+00,
446aeaa1-e356-4aad-8073-d97efecaed34,9db4ec53-6ae6-4c1f-973d-9afe66231ebc,PSJA EARLY COLLEGE H S,PSJA EARLY COLLEGE H S,false,false,,2025-05-19 00:50:01.865692+00,2025-05-19 00:50:01.865692+00,
44874a68-3056-4b63-8165-dc2c57a5bac8,11dcfe9e-83bb-4f5e-9eae-2a502e15d8b1,California University-Silicon Valley California University-Silicon Valley,California University-Silicon Valley California University-Silicon Valley,true,false,94747,2025-05-18 20:36:00.880104+00,2025-05-18 20:36:00.880104+00,
44b587cc-0591-4168-819b-b36b10a98af3,0ecbd347-f9d6-4ca5-8064-b8d6f0e7d5d3,Loyola Marymount University Loyola Marymount University,Loyola Marymount University Loyola Marymount University,true,false,6557,2025-05-18 18:43:13.676643+00,2025-05-18 18:43:13.676643+00,
44ba9079-efb1-4bf3-b0da-77dd61c90a5f,a2b40050-a1b2-46ac-aa34-c5375a9cb86a,Touro University Touro University Long Island,Touro University Touro University Long Island,true,false,2815356,2025-05-18 22:22:39.033244+00,2025-05-18 22:22:39.033244+00,
44d11bc8-113b-46c2-9dfb-0e77b4a2bc50,448933b1-1349-4c9f-aca3-159e18db7a2d,Full Sail University Full Sail University,Full Sail University Full Sail University,true,false,416,2025-05-18 20:47:22.051555+00,2025-05-18 20:47:22.051555+00,
44fcfec9-526f-4593-a05f-198f71451987,a0d1bc42-1f3e-4905-8f26-b7cc4253b478,California Military Institute,California Military Institute,false,false,,2025-05-19 00:38:28.984784+00,2025-05-19 00:38:28.984784+00,
4500da37-c690-4c07-893e-927c0c3d57eb,9f55c274-6443-4af3-920f-16597aaffc13,Shasta Bible College & Graduate School Shasta Bible College & Graduate School,Shasta Bible College & Graduate School Shasta Bible College & Graduate School,true,false,13135,2025-05-18 20:51:23.418715+00,2025-05-18 20:51:23.418715+00,
455c5e79-1fcd-4a06-a1d5-3e71f0063f0f,c3f3efb0-dbba-4055-a5c8-a3057dad05e2,IS 347 SCHOOL OF HUMANITIES,IS 347 SCHOOL OF HUMANITIES,false,false,,2025-05-19 00:26:29.463324+00,2025-05-19 00:26:29.463324+00,
4575354d-1d19-49d0-8404-f4a0d6bdebc6,ee6af5fc-6ef7-492e-a2e8-9645c648afe1,San Bernardino Community College District San Bernardino Valley College,San Bernardino Community College District San Bernardino Valley College,true,true,7773,2025-05-18 19:54:47.464505+00,2025-05-18 19:54:47.464505+00,
45d0fc88-c3f0-41b9-8373-edf4a6c7b925,650c17aa-2e0d-4cbd-9c84-dddb1b049bb1,Philistine Rondo School of Discovery,Philistine Rondo School of Discovery,false,false,,2025-05-19 00:52:56.732726+00,2025-05-19 00:52:56.732726+00,
45d8f915-5d14-4b3b-b34e-960a2716db4d,01f472cf-0f8c-4255-977a-c60a99bd580e,Bard College Bard Graduate Center (BGC),Bard College Bard Graduate Center (BGC),true,false,5088072,2025-05-18 19:58:46.942463+00,2025-05-18 19:58:46.942463+00,
45e1c5fc-a37b-4a53-88b6-a269d0789620,22194923-9da4-4116-a28d-122936aaec83,Troy University Montgomery,Troy University Montgomery,true,false,91458,2025-05-18 18:45:27.912481+00,2025-05-18 18:45:27.912481+00,
45e3ce6f-4e27-4288-a647-71b9c5dd32ab,9292e290-d634-4819-b7a7-b2200c5e0f72,Walden School of Liberal Arts,Walden School of Liberal Arts,false,false,,2025-05-19 00:30:55.791095+00,2025-05-19 00:30:55.791095+00,
460782be-653f-4de9-8d0b-b525e58cb843,d9fcef4a-e55d-4969-8972-b72fda46383a,Grossmont College Grossmont College,Grossmont College Grossmont College,true,false,862,2025-05-18 20:39:23.395108+00,2025-05-18 20:39:23.395108+00,
46119d3c-7889-4753-8401-2e4e7e9a304d,65203675-1e10-47a1-ba25-c1364b1abd66,University of Wisconsin-Green Bay UW Green Bay - Manitowoc Campus,University of Wisconsin-Green Bay UW Green Bay - Manitowoc Campus,true,false,5025901,2025-05-18 21:47:08.927897+00,2025-05-18 21:47:08.927897+00,
461c6866-0287-46f8-8b92-198f90781414,765f5e54-ca7d-4ca7-bc7a-919b94f848cc,Berkeley Technology Academy,Berkeley Technology Academy,false,false,,2025-05-19 00:24:25.276315+00,2025-05-19 00:24:25.276315+00,
461d6eac-516d-4fc0-94c5-55462776a1c9,abe80157-f015-42c4-a4c8-b04c7100d2b9,Sonoma State University Sonoma State University,Sonoma State University Sonoma State University,true,false,4839,2025-05-18 21:44:49.512404+00,2025-05-18 21:44:49.512404+00,
46248154-f082-4362-8eac-57f24d9af5aa,69f148d4-d531-436c-a85e-b0b517d50e33,Northwest Florida State College Chautauqua Center,Northwest Florida State College Chautauqua Center,true,true,182473,2025-05-18 22:35:23.106529+00,2025-05-18 22:35:23.106529+00,
